hash,author,date,message,category,logs_added,logs_removed,logs_modified
2c22d6979393e604d3a1385ad093061e95d8b2b4,Botond Dénes,Fri Apr 3 06:38:05 2026 +0300,Merge 'Pytest: fix variable handling in GSServer (mock) and ensure docker service logs go to test log as well' from Calle Wilund,bug_fix,0,0,0
b6ebbbf036ad555de5bbcf666ffd147e8197d8ac,Raphael S. Carvalho,Wed Apr 1 20:23:52 2026 -0300,test/cluster/test_tablets2: Fix test_split_stopped_on_shutdown race with stale log messages,bug_fix,0,0,0
4d4ce074bb1025de6a03afcc3b156dee56da9602,Aleksandra Martyniuk,Wed Apr 1 14:58:48 2026 +0200,test: node_ops_tasks_tree: reconnect driver after topology changes,other,0,0,0
d438e35cdd3ce087cf13d1d130aa8487d77a9057,Avi Kivity,Tue Mar 31 14:09:10 2026 +0300,test/cluster: fix race in test_insert_failure_standalone audit log query,bug_fix,0,0,0
216d39883a7e1421430ad5b239dc7306381a2cba,Avi Kivity,Tue Mar 31 13:53:01 2026 +0300,Merge 'test: audit: fix audit test syslog race' from Dario Mirovic,bug_fix,0,0,0
b9f82f6f23a30c2405d26a039fabb79ac087d11c,Patryk Jędrzejczak,Fri Mar 27 15:52:05 2026 +0100,raft_group0: join_group0: fix join hang when node joins group 0 before post_server_start,bug_fix,0,0,0
0cb63fb669a73d18391e86a1cc0b7aa96862ced3,Dario Mirovic,Tue Mar 31 02:25:15 2026 +0200,test: cluster: wait for full config reload in audit live-update path,other,0,0,0
1d623196ebc4d67e85ab65ea460e00be0566f569,Dario Mirovic,Tue Mar 31 02:24:51 2026 +0200,test: cluster: fix syslog listener datagram ordering race,bug_fix,0,0,0
854c374ebf2b6a309d786ae510108c2de1b618af,Botond Dénes,Tue Mar 24 12:13:20 2026 +0200,test/encryption: wait for topology convergence after abrupt restart,other,0,0,0
5a086ae9b7464933b2dd4615ec3b6c25c0492880,bitpathfinder,Thu Mar 26 18:25:05 2026 +0100,test: fix race condition in test_crashed_node_substitution,bug_fix,0,0,0
141aa2d696c97da97b3fdbeb041aacc6482535ae,Patryk Jędrzejczak,Tue Mar 24 16:27:01 2026 +0100,Merge 'test/cluster/test_incremental_repair.py: fix typo + enable compaction DEBUG logs' from Botond Dénes,bug_fix,0,0,0
f1b3bff4a5d1b965825128456d9fac10f44f0a07,Calle Wilund,Wed Mar 18 18:32:37 2026 +0100,dockerized_service: Convert log reader to pipes and push to test log,other,0,0,0
148217bed6652cd4692c5892608013238df44096,Dawid Mędrek,Mon Mar 23 19:12:12 2026 +0100,test: cluster: Increase log level in test_write_cl_any_to_dead_node_generates_hints,logging_improvement,0,0,0
60fb5270a9d89140cf305418130d006c78265fef,Piotr Dulikowski,Fri Mar 20 12:07:32 2026 +0100,logstor: fix fmt::format use with std::filesystem::path,bug_fix,0,0,0
f5438e0587091662502e53ea283a775105ebab05,Botond Dénes,Mon Mar 23 15:45:22 2026 +0200,test/cluster/test_incremental_repair.py: enable compaction DEBUG logs in do_tablet_incremental_repair_and_ops,bug_fix,0,0,0
0a8dc4532b6b6938f2b1e0398b6620709874fd07,Pavel Emelyanov,Mon Mar 16 10:53:53 2026 +0300,s3: Fix missing upload ID in copy_part trace log,bug_fix,0,0,0
ea2a214959e90b18613b7c97dabd983bb0bab6a1,Pavel Emelyanov,Fri Mar 13 15:15:23 2026 +0300,test/backup: Use unique_name() for backup prefix instead of cf_dir,bug_fix,0,0,0
6b259babeb0ef14c82082d67871b8fca19afde7f,Avi Kivity,Fri Mar 20 00:02:16 2026 +0200,Merge 'logstor: initial log-structured storage for key-value tables' from Michael Litvak,other,0,0,0
d2c44722e1dedb0d1dd195d29de37eea19727fe8,Dario Mirovic,Thu Mar 5 18:50:11 2026 +0100,test: cluster: fix log clear race condition in test_audit.py,bug_fix,0,0,0
249a6cec1b9a422400a34d8f73d028a89d0d384f,Dario Mirovic,Wed Feb 25 03:15:29 2026 +0100,test: cluster: dtest: remove old audit tests,other,0,0,0
967b7ff6bf958d219d480b6a82fa8dd74f925b75,Dario Mirovic,Mon Feb 16 06:09:54 2026 +0100,test: cluster: enable migrated audit tests and make them work,other,0,0,0
0a7a69345c98c575b5646e5bc1de7a32daad08a6,Dario Mirovic,Mon Feb 16 06:03:05 2026 +0100,test: pylib: scylla cluster after_test log fix,bug_fix,0,0,0
899ae713498f07834cde0e71f5d025002c8d8d37,Dario Mirovic,Sun Feb 15 16:24:45 2026 +0100,test: audit: copy audit test from dtest,other,0,0,0
399260a6c048764f98ca225ee02c280cb8a9ef38,Michael Litvak,Wed Mar 11 19:30:07 2026 +0100,test: mv: fix flaky wait for commitlog sync,bug_fix,0,0,0
31d339e54a812c9121d2ed88a66c73b77ba060fd,Michael Litvak,Tue Mar 17 12:26:33 2026 +0100,logstor: trigger separator flush for buffers that hold old segments,other,0,0,0
ad87eda835dede5294318b049afcc2439b84e6d2,Michael Litvak,Mon Mar 2 10:34:33 2026 +0100,docs/dev: add logstor documentation,feature,0,0,0
a0da07e5b708ed997ccbf90e102e4810b9325a66,Michael Litvak,Sun Mar 15 12:54:55 2026 +0100,logstor: recover segments into compaction groups,other,0,0,0
24379acc76c7ae346563240844f85f572326e2ff,Michael Litvak,Sat Mar 14 14:46:54 2026 +0100,logstor: range read,other,0,0,0
a9d0211a64481f2a3fb34dbe39d6fb2f56a73420,Michael Litvak,Sat Mar 14 13:21:54 2026 +0100,logstor: change index to btree by token per table,other,0,0,0
e7c3942d43d72c284e6429071c73df93c8009baa,Michael Litvak,Tue Mar 10 20:11:29 2026 +0100,logstor: move segments to replica::compaction_group,other,0,0,0
65cd0b563988eed8ae991c8bd74fbaef439d47a2,Michael Litvak,Sun Mar 8 11:45:56 2026 +0100,logstor: track memory usage,other,0,0,0
b7bdb1010afa2628eedb30a41b336dfdbca7c758,Michael Litvak,Wed Feb 25 08:31:37 2026 +0100,logstor: logstor stats api,other,0,0,0
8bd3bd7e2a9b3dc1e8148a08999664542181af5d,Michael Litvak,Thu Feb 26 14:48:54 2026 +0100,logstor: compaction buffer pool,other,0,0,0
caf5aa47c2ff97b56367f6adef69817fca40b950,Michael Litvak,Mon Feb 23 16:25:34 2026 +0100,logstor: separator: flush buffer when full,other,0,0,0
6ddb7a4d130e4c2079cdbd201a7b2c275892ae38,Michael Litvak,Sun Feb 22 18:29:01 2026 +0100,logstor: hold segment until index updates,other,0,0,0
bd66edee5ca6ccbf0ee4a7cd6511bc246ad68f29,Michael Litvak,Sat Feb 21 13:42:25 2026 +0100,logstor: truncate table,other,0,0,0
489efca47c0388ceec95c0bdf89657d279dc59dc,Michael Litvak,Sat Feb 21 13:43:59 2026 +0100,logstor: enable/disable compaction per table,other,0,0,0
21db4f3ed80ad439224f37fbb75817dceba7c1cf,Michael Litvak,Mon Feb 16 19:20:17 2026 +0100,logstor: separator buffer pool,other,0,0,0
37c485e3d15c30f5e39b378eed218042d0562100,Michael Litvak,Tue Feb 24 16:47:00 2026 +0100,test: logstor: add separator and compaction tests,feature,0,0,0
31aefdc07dbe24e064ad8152c347efa01ca70526,Michael Litvak,Sun Feb 15 21:42:45 2026 +0100,logstor: segment and separator barrier,other,0,0,0
1231fafb46f5a67640fd68c4932c145f083151eb,Michael Litvak,Sun Feb 15 08:58:45 2026 +0100,logstor: separator debt controller,other,0,0,0
17cb173e18bad334d7d93754a65bcbe65b50704d,Michael Litvak,Sat Feb 14 12:42:28 2026 +0100,logstor: compaction controller,other,0,0,0
1da1bb9d99f42c4c9ecf06cf11038824b2ebb031,Michael Litvak,Thu Feb 12 16:45:59 2026 +0100,logstor: recovery: recover mixed segments using separator,other,0,0,0
b78cc787a6ba2c0f8c698dfd37d46b47c52d2748,Michael Litvak,Mon Feb 9 18:58:30 2026 +0100,logstor: wait for pending reads in compaction,other,0,0,0
600ec82bec100018df4d1738e5ea2660459d7361,Michael Litvak,Sun Feb 8 18:56:52 2026 +0100,logstor: separator,other,0,0,0
009fc3757a4f301de768bc6a635fa1b9c546ad05,Michael Litvak,Thu Feb 5 23:06:19 2026 +0100,logstor: compaction groups,other,0,0,0
b3293f8579ee703f5f64727c8172f585e133f8aa,Michael Litvak,Mon Feb 9 12:17:38 2026 +0100,logstor: cache files for read,other,0,0,0
5a16980845583dfbf0f7bf88e56fe19f82be6821,Michael Litvak,Sun Feb 1 09:53:34 2026 +0100,logstor: recovery: initial,other,0,0,0
bc9fc96579ee2ecc5779d00f9197796b378d700c,Michael Litvak,Thu Feb 12 14:19:58 2026 +0100,logstor: add segment generation,feature,0,0,0
719f7cca576d94439d55fbaaac9daf566ec9423f,Michael Litvak,Mon Feb 2 14:19:27 2026 +0100,logstor: reserve segments for compaction,other,0,0,0
521fca5c92d2858429a2ca6989a5c20181c4cca3,Michael Litvak,Mon Feb 2 08:29:23 2026 +0100,logstor: index: buckets,other,0,0,0
99c3b1998adaf6507e1b922d717ac560a420d95a,Michael Litvak,Sat Jan 31 17:26:18 2026 +0100,logstor: add buffer header,feature,0,0,0
ddd72a16b08a5d67a28ddc90829d4791dd299ea0,Michael Litvak,Fri Jan 30 10:02:49 2026 +0100,logstor: add group_id,feature,0,0,0
08bea860ef6acbe048bc0445590d63af505167bf,Michael Litvak,Sun Feb 1 09:53:23 2026 +0100,logstor: record generation,other,0,0,0
28f820eb1c8e02727982c3f1cbc528f9bb3a1f32,Michael Litvak,Sun Feb 1 12:21:06 2026 +0100,logstor: generation utility,other,0,0,0
5f649dd39f61fca1c748815348c6155a2b275ffc,Michael Litvak,Mon Jan 26 19:14:50 2026 +0100,logstor: use RIPEMD-160 for index key,other,0,0,0
a521bcbcee7e87dbe186e7020bf955ee8b21bff8,Michael Litvak,Sat Jan 24 20:06:55 2026 +0100,test: add test_logstor.py,feature,0,0,0
1ae1f37ec15ce2c0f7183cb4bc2230e26118bf2d,Michael Litvak,Thu Jan 29 15:05:37 2026 +0100,api: add logstor compaction trigger endpoint,feature,0,0,0
2128b1b15cfed9a03405e2c2b578c52a5f0f4854,Michael Litvak,Fri Jan 16 14:05:58 2026 +0100,replica: add logstor to db,feature,0,0,0
9172cc172eb47e53678e2f25be510929d2d21ed4,Michael Litvak,Fri Jan 16 21:13:35 2026 +0100,schema: add logstor cf property,feature,0,0,0
0b1343747f8f4b37ae4e55c199dcd925810ad65b,Michael Litvak,Thu Jan 15 18:56:33 2026 +0100,logstor: initial commit,other,0,0,0
27fd0c119fdba2119cfc28114530d44b943c853b,Michael Litvak,Wed Feb 4 14:51:15 2026 +0100,db: disable tablet balancing with logstor,other,0,0,0
ed852a2af2eb08bca42090964a201aa1bdaddf7a,Michael Litvak,Wed Feb 4 14:47:28 2026 +0100,db: add logstor experimental feature flag,feature,0,0,0
3775593e532420f99a317eefb1b6d611cabb28c7,Tomasz Grabiec,Mon Feb 9 21:17:07 2026 +0100,test: perf_simple_query: Add 'sstable-format' command-line option,feature,0,0,0
6ee9bc63ebb67d7aab8760027a170400d37314a4,Tomasz Grabiec,Mon Feb 9 21:16:59 2026 +0100,test: perf_simple_query: Add 'sstable-summary-ratio' command-line option,feature,0,0,0
38d130d9d0cbd0d42b57d0b25d45328176ecfcee,Tomasz Grabiec,Fri Feb 6 15:40:57 2026 +0100,test: perf-simple-query: Add option to disable index cache,feature,0,0,0
d4fdeb483975a6617e590516dba7353aba20b36e,Aleksandra Martyniuk,Fri Mar 13 17:13:39 2026 +0100,tasks: pass token_metadata_ptr to task_manager::virtual_task::impl::get_children,other,0,0,0
ae17596c2aaaf762b7ec3cbd562ae231bdf8f092,Botond Dénes,Wed Mar 18 16:21:05 2026 +0200,Merge 'Demote log level on split failure during shutdown' from Raphael Raph Carvalho,logging_improvement,0,0,0
b1d4fc5e6e5ba6fb5cd8cc196b1618ec8c4fc527,Pavel Emelyanov,Wed Mar 11 13:58:56 2026 +0300,test: Squash test_restore_primary_replica_same,other,0,0,0
21c603a79ece3efb30a1d86a83d9b749e247a024,Pavel Emelyanov,Wed Mar 11 13:56:33 2026 +0300,test: Use the same regexp in test_restore_primary_replica_different,other,0,0,0
06d16b6ea240700223583e5478d73e2d21ed0946,Marcin Maliszkiewicz,Tue Feb 24 18:32:54 2026 +0100,auth: cache: add heterogeneous map lookups,feature,0,0,0
71e6918f28aabbc03f911310d1f26b96f3f2a6a5,Dario Mirovic,Tue Mar 17 20:20:47 2026 +0100,test: use NetworkTopologyStrategy in maintenance socket tests,other,0,0,0
9318c80203df9fb5c998487438093d1fd6fd382a,Marcin Maliszkiewicz,Mon Mar 16 16:13:53 2026 +0100,perf: add abort_source support to wait-for-port loops,feature,0,0,0
a5df2e79a7577c0e5bc1bd6c3fe8e4d419ca2d5d,Calle Wilund,Tue Mar 10 09:00:28 2026 +0100,storage_service: Wait for snapshot/backup before decommission,other,0,0,0
edf0148bee62fd78c810e2d2bd3280369eeaebc1,Marcin Maliszkiewicz,Mon Mar 16 16:07:10 2026 +0100,perf-alternator: wait for alternator port before running workload,other,0,0,0
85d5073234d81857e878b227bdc813bf4a351ce5,bitpathfinder,Wed Mar 4 15:00:28 2026 +0100,test: Fix non-awaited coroutine in test_gossiper_empty_self_id_on_shadow_round,bug_fix,0,0,0
ee87b66033bc017bf62adb9f7b1f191c8db27b86,Raphael S. Carvalho,Fri Mar 13 11:39:44 2026 -0300,replica: Demote log level on split failure during shutdown,logging_improvement,0,0,0
526e5986fefbd1edb9a468dfae8b0c833956b15e,Patryk Jędrzejczak,Wed Mar 11 13:11:40 2026 +0100,test: test_raft_no_quorum: decrease group0_raft_op_timeout_in_ms after quorum loss,other,0,0,0
b508f3dd389348edcada6e56a05aab9740fecd8b,Raphael S. Carvalho,Fri Mar 13 09:43:05 2026 -0300,service: Demote log level on split failure during shutdown,logging_improvement,0,0,0
755d528135cfdd52a5d1cc35115409f4e6793632,Artsiom Mishuta,Mon Mar 9 15:14:31 2026 +0100,test.py: fix warnings,bug_fix,0,0,0
d544d8602d4c286c7d4921fd673985fa92524927,Pavel Emelyanov,Tue Mar 3 17:20:49 2026 +0300,test: Relax topology_rf_validity parameter for some tests,other,0,0,0
1256a9faa7987fe6ce6afb71fe760bfdbbad197b,Tomasz Grabiec,Wed Mar 11 18:34:23 2026 +0100,tablets: Fix deadlock in background storage group merge fiber,bug_fix,0,0,0
279fcdd5ff2e5375a5291352b9e79ef607b45bfb,Tomasz Grabiec,Tue Mar 10 18:04:29 2026 +0100,storage_service: Extract local_topology_barrier(),other,0,0,0
b3fec20960e73856677473a1fac0071b1e9158cd,Benny Halevy,Thu Mar 5 16:09:30 2026 +0200,test_tablets_migration: test_staging_backlog_is_preserved_with_file_based_streaming: convert for loop to asyncio.gather,other,0,0,0
adc840919b167868bb86c597c7bf066aec19e114,Marcin Maliszkiewicz,Wed Mar 11 15:55:31 2026 +0100,"auth: move default_superuser to common, remove _superuser member",other,0,0,0
993e06c1aeb299a1a7e884a99cf33e93c5c87270,Marcin Maliszkiewicz,Wed Mar 11 15:52:32 2026 +0100,auth: use LOCAL_ONE for all auth queries,other,0,0,0
6d1153687a01b6a7039beb0631725700861ca303,Marcin Maliszkiewicz,Wed Mar 11 15:51:15 2026 +0100,auth: remove get_auth_ks_name indirection,other,0,0,0
2e68f480682d6c1d99a7365267d706e1f8dd685b,Aleksandra Martyniuk,Fri Feb 20 11:14:13 2026 +0100,nodetool: cluster repair: do not fail if a table was dropped,other,0,0,0
475220b9c9ce7c3bef49991eb1234497c95a8ebc,Botond Dénes,Wed Mar 11 10:24:20 2026 +0200,Merge 'Remove the rest of pre raft topology code' from Gleb Natapov,other,0,0,0
cc5b1acadf1cbd4cf59da1880a3eb8c3f9d515de,Raphael S. Carvalho,Thu Mar 5 16:34:16 2026 -0300,Improve log when sstable load fails due to missing tablet replica,refactor,0,0,0
02257d142940c0029ae1a7ddfb21a119ef4008f7,Aleksandra Martyniuk,Fri Jan 23 15:55:34 2026 +0100,test: add test_tablet_repair_wait,feature,0,0,0
27051d9a7cae8db8451758376294cce87c497c47,Alex,Mon Mar 9 11:54:21 2026 +0200,cql3: pin prepared cache entry in prepare() to avoid invalid weak handle race,other,0,0,0
37f8cdf485e7e0d43b22f9d74cc678cf5bdc4f72,Piotr Dulikowski,Tue Mar 10 12:29:23 2026 +0100,Merge 'test.py: fix unawaited ScyllaLogFile.grep() coroutines' from Andrei Chekun,bug_fix,0,0,0
4660f908f93285d73d367b49df67e7ba5e079051,Gleb Natapov,Tue Feb 24 16:24:04 2026 +0200,auth: drop auth_migration_listener since it does nothing now,other,0,0,0
f76199e5c2f0c8332e153720e46cdbd758002454,Gleb Natapov,Wed Feb 18 14:20:45 2026 +0200,schema: remove calculate_schema_digest function,other,0,0,0
6769615ff183c74f337d56f47144603977e935ec,Gleb Natapov,Tue Feb 17 13:24:46 2026 +0200,storage_service: no need to add yourself to the topology during reboot since raft state loading already did it,feature,0,0,0
8ee4cdd4b74b61fe86df50d3496cc9815a721291,Gleb Natapov,Thu Feb 12 19:13:30 2026 +0200,storage_service: do not pass loaded_peer_features to join_topology(),feature,0,0,0
6f739a8ee44af0bb149237823129b9f419dd4a6e,Gleb Natapov,Thu Feb 12 18:13:19 2026 +0200,storage_service: remove unused variables from join_topology,other,0,0,0
d35b83bec8b9061a1b8eb37b017ea08a492bcbba,Gleb Natapov,Thu Feb 12 17:20:28 2026 +0200,gossiper: remove the code that was only used in gossiper topology,other,0,0,0
1d188f039445d466c54406b495e09a4be6a2d0a3,Gleb Natapov,Tue Feb 10 17:41:12 2026 +0200,auth: remove legacy auth mode and upgrade code,other,0,0,0
0cf726c81fdc8950c2d0090e6347b286aa3c9517,Gleb Natapov,Tue Feb 10 15:57:37 2026 +0200,raft topology: drop upgrade_state and its type from the topology state machine since it is not used any longer,other,0,0,0
1ff98c89e373de07758d5930232152f8d1034ce5,Gleb Natapov,Sun Feb 8 16:03:56 2026 +0200,api: drop get_topology_upgrade_state and always report upgrade status as done,other,0,0,0
be153a4eb7a631b2f203e3a9c7c66737fe0ed530,Gleb Natapov,Sun Feb 8 15:47:03 2026 +0200,service_level_controller: drop service level upgrade code,other,0,0,0
d4b55de214b6fe1dca260161316c59c38a310fe5,Gleb Natapov,Thu Feb 5 17:59:50 2026 +0200,storage_service: drop topology_change_kind as it is no longer needed,other,0,0,0
68ea6aa0a6f480450774ff5b6cba0c42a9a5afc1,Gleb Natapov,Thu Feb 5 17:31:02 2026 +0200,storage_service: drop check_ability_to_perform_topology_operation since no upgrades can happen any more,other,0,0,0
49ebab971d8222543058d48f99f418b610214a02,Gleb Natapov,Thu Feb 5 17:05:58 2026 +0200,storage_service: set topology change kind only once,other,0,0,0
8acba40c84c6ba0f8f6a429f138709cf13a26aa1,Andrei Chekun,Thu Mar 5 15:16:55 2026 +0100,test.py: fix unawaited ScyllaLogFile.grep() coroutines,bug_fix,0,0,0
4c8681a9273dd910eedd90320e2fd1348e1e60d7,Marcin Maliszkiewicz,Thu Feb 19 17:48:21 2026 +0100,raft: add function to broadcast read barrier request,feature,0,0,0
e0483f6001e4c77d43fe15a8ffefb8d73cfca5e7,Asias He,Mon Mar 9 08:46:40 2026 +0800,test: Fix coordinator assumption in do_test_tablet_incremental_repair_merge_error,bug_fix,0,0,0
40dca578c5f0443f384c40f809eb97ba6f1610e8,Aleksandra Martyniuk,Fri Mar 6 14:41:07 2026 +0100,test: add test_tablet_repair_wait_with_table_drop,feature,0,0,0
f12e4ea42b5d3373a34cbd857a64528309379a4b,Piotr Smaron,Fri Mar 6 14:46:37 2026 +0100,test_proxy_protocol: introduce extra logging to aid debugging,bug_fix,0,0,0
6aef4d35412ad82866989793f4a79721d95aa546,Michał Jadwiszczak,Wed Feb 4 16:20:49 2026 +0100,test/cluster/test_strong_consistency: add reproducer for missing schema during apply,feature,0,0,0
b0cffb2e81eb907d221cf0f9dde74fba3ecd60a4,Michał Jadwiszczak,Wed Feb 18 09:36:14 2026 +0100,strong_consistency/state_machine: find and hold schemas of applying mutations,other,0,0,0
b90fe19a429757231f54fa503467f1f625af2edb,Tomasz Grabiec,Thu Mar 5 13:28:13 2026 +0100,Merge 'service: assert that tables updated via group0 use schema commitlog' from Aleksandra Martyniuk,other,0,0,0
1cbd0da5193b67798383b8f64e3072372ab92e63,Patryk Jędrzejczak,Wed Mar 4 15:13:19 2026 +0100,raft: log: clarify the specification of term_for,other,0,0,0
2a3476094e6788932f66cb8a52f97f76c3938ee1,Patryk Jędrzejczak,Mon Feb 23 15:28:17 2026 +0100,storage_service: raft_topology_cmd_handler: fix use-after-free,bug_fix,0,0,0
156c29f9625753c6b9e2a81f6b250592698713c1,Aleksandra Martyniuk,Wed Mar 4 13:55:09 2026 +0100,test: add test_group0_tables_use_schema_commitlog,feature,0,0,0
5306e26b838db5846ab1a09d25a4cfecb0e2c06e,Aleksandra Martyniuk,Wed Mar 4 13:06:38 2026 +0100,db: service: remove group0 tables from schema commitlog schema initializer,other,0,0,0
690b2c414204391308b277856bc4780db3d8d930,Aleksandra Martyniuk,Wed Mar 4 12:35:59 2026 +0100,service: ensure that tables updated via group0 use schema commitlog,other,0,0,0
6b3b1747044e79d238b26baf2880a79fc5bb1b11,Aleksandra Martyniuk,Wed Mar 4 17:21:01 2026 +0100,db: schema: remove set_is_group0_table param,other,0,0,0
57f1e462049e160bdb77177bdeb0917d3c1cf071,Aleksandra Martyniuk,Wed Mar 4 13:44:30 2026 +0100,test: cluster: tasks: await set_task_ttl,other,0,0,0
c1b0ac141bc284dde3ff9f14f51fc6646c65a944,Pavel Emelyanov,Sat Feb 28 09:58:31 2026 +0300,test_backup: Patch backup tests to use take_snapshot(),bug_fix,0,0,0
e7487c21e49249ca38a81d53150b5bd4988ecc85,Botond Dénes,Wed Feb 25 12:13:21 2026 +0200,"test/{boost,cluster}: add test for tombstone gc mode=repair with RF=1",feature,0,0,0
ec42fdfd01ae207fac89b9929704bf4571b8d99a,Andrzej Jackowski,Mon Feb 23 19:59:42 2026 +0100,test: add cluster tests for write CL guardrails,feature,0,0,0
225b10b683d4988617c25e71f73c0e0edb099f69,Asias He,Mon Dec 15 10:25:11 2025 +0800,repair: Fix rwlock in compaction_state and lock holder lifecycle,bug_fix,0,0,0
f74fe22386fd7c73946a610d707c362b86427108,Dario Mirovic,Fri Feb 20 16:01:26 2026 +0100,test: cluster: add logs to test_maintenance_socket.py,feature,0,0,0
45628cf041c7cc9d89584a47461849f23f1c5e17,Dario Mirovic,Fri Nov 21 02:51:37 2025 +0100,auth: enable role management operations via maintenance socket,other,0,0,0
3bef493a358d939370f824e875abaa6e36d2ddf3,Dario Mirovic,Mon Feb 9 00:46:56 2026 +0100,auth: remove class registrator usage,other,0,0,0
7fd083e329949b9d07f549184685146a63d8d80e,Dawid Mędrek,Tue Mar 3 18:48:49 2026 +0100,test: raft: Introduce get_default_cluster,other,0,0,0
5c84a76b28e0d62b5d087911c81de13c37d8c047,Artsiom Mishuta,Wed Feb 18 14:04:14 2026 +0100,test.py: setup pytest logger,other,0,0,0
d95939d69aca4b7a452726349a74be4056b17b48,Marcin Maliszkiewicz,Mon Mar 2 14:53:46 2026 +0100,test: add more logs to test_startup_no_auth_response,feature,0,0,0
a83ee6cf669b822331b724b317eb8fadef006408,Marcin Maliszkiewicz,Mon Mar 2 12:09:10 2026 +0100,Merge 'db/batchlog_manager: re-add v1 support for mixed clusters' from Botond Dénes,feature,0,0,0
ba7f314cdc5a823542c218044555bbe15ba388ac,Patryk Jędrzejczak,Fri Feb 27 13:29:14 2026 +0100,test: test_full_shutdown_during_replace: retry replace after the replacing node is removed from gossip,other,0,0,0
9a9202c9096809ce9e939c0226b5c94c09cc1809,Patryk Jędrzejczak,Fri Feb 27 14:43:40 2026 +0100,Merge 'Remove gossiper topology code' from Gleb Natapov,other,0,0,0
97dc88d6b6756638d31ea7024b59003468bef99a,Wojciech Mitros,Mon Feb 2 04:39:21 2026 +0100,test/cluster: add tests for strongly-consistent tables' metadata persistence,feature,0,0,0
ffe32e8e4d638d78fce7873228bdbe3ed8af9c22,Wojciech Mitros,Mon Feb 2 04:37:19 2026 +0100,test/raft: add unit tests for raft_groups_storage,feature,0,0,0
16977d7aa0900c803fc635a33ced2905a00b05f5,Wojciech Mitros,Mon Feb 2 04:17:27 2026 +0100,raft: add raft_groups_storage persistence class,feature,0,0,0
654fe4b1ca939817dcb229e2dfe36781b6742b96,Wojciech Mitros,Mon Feb 2 04:14:38 2026 +0100,db: add system tables for strongly consistent tables' raft groups,feature,0,0,0
cb0caea8bf53443859943b6467ce59817b099d3e,Wojciech Mitros,Mon Feb 2 04:12:30 2026 +0100,dht: add fixed_shard_partitioner and fixed_shard_sharder,bug_fix,0,0,0
56cc7bbeec0ef77da74987d48eb9edd059669f5f,Botond Dénes,Wed Feb 25 10:17:53 2026 +0200,"Merge 'Allow ""global"" snapshot using topology coordinator + add tablet metadata to manifest' from Calle Wilund",feature,0,0,0
166e245097b788e9219b24c00a5d2dab3181a766,Botond Dénes,Wed Feb 25 10:17:20 2026 +0200,Merge 'test.py: Topology test pytest integration' from Andrei Chekun,other,0,0,0
6173ea476b323116ec090dc01eeed3d2910a2e69,Gleb Natapov,Mon Feb 2 16:16:58 2026 +0200,node_ops: remove topology over node ops code,other,0,0,0
758d1c9c3946a36db83e15c7ec6d98fe4abdaf3d,Gleb Natapov,Mon Feb 2 14:10:44 2026 +0200,topology: fix indentation after the previous patch,bug_fix,0,0,0
67cd5755b2e81e6d950fd955fd313b58c23a2d28,Gleb Natapov,Mon Feb 2 14:09:49 2026 +0200,topology: drop topology_change_enabled parameter from raft_group0 code,other,0,0,0
5fa4f5b08ffebbd07a495d1b3d59a9e5575cd660,Gleb Natapov,Mon Feb 2 11:12:33 2026 +0200,storage_service: drop is_topology_coordinator_enabled and its uses,other,0,0,0
a8a167623a2c92891b21de455a566022c1dbb4bd,Gleb Natapov,Sun Feb 1 16:43:54 2026 +0200,topology: remove code that assumes raft_topology_change_enabled() may return false,other,0,0,0
5557770b5902f53eac092f017f3661bad6870ad5,Alex,Mon Feb 23 18:18:38 2026 +0200,test_mv_build_during_shutdown started two async CREATE MATERIALIZED VIEW operations and never awaited them (asyncio.gather(...) without await).,other,0,0,0
edf7154fee0f40853991122b659dca12cd1dcd59,Andrei Chekun,Tue Jan 13 15:57:36 2026 +0100,test.py: add random seed for topology tests reproducibility,feature,0,0,0
92049c3205eb09ae083c5a539febf799babbe316,Gleb Natapov,Thu Jan 29 14:32:15 2026 +0200,topology: remove upgrade to raft topology code,other,0,0,0
4a9cf687ccb52f8e50922f4f52a1ffca9bbae4fa,Gleb Natapov,Thu Jan 29 13:29:34 2026 +0200,group0: remove upgrade to group0 code,other,0,0,0
dcafb5c083702f6b320be5005a4c2af0d0c04b6e,Gleb Natapov,Wed Jan 28 14:15:18 2026 +0200,group0: refuse to boot if a cluster is still is not in a raft topology mode,other,0,0,0
fec7df7cbbb6ac3c621d42ca408ac83bb4b5a072,Calle Wilund,Tue Feb 3 17:45:57 2026 +0100,topology::snapshot: Add expiry (ttl) to RPC/topo op,feature,0,0,0
968054114494aee0736d11667ea1c27a681f4bb6,Calle Wilund,Mon Feb 9 09:30:12 2026 +0100,db::snapshot-ctl: Add method to do snapshot using topo coordinator,feature,0,0,0
012a0653648ae8e4cb629417f84057a9c181bf4d,Calle Wilund,Tue Feb 3 12:58:01 2026 +0100,topology_coordinator: Add handler for snapshot_tables,feature,0,0,0
3075311f217f06ea74446861e27fce0ffb1d4cd9,Calle Wilund,Tue Feb 3 12:50:55 2026 +0100,feature_service: Add SNAPSHOT_AS_TOPOLOGY_OPERATION feature,feature,0,0,0
988c5238cf8375960f9b198cc7df2a374050525e,Calle Wilund,Tue Feb 3 12:49:39 2026 +0100,topology_mutation: Add setter for snapshot part of row,feature,0,0,0
8bb81f00f8ec27833b5e97055fb4e85b7a1abb4f,Calle Wilund,Tue Feb 3 12:48:38 2026 +0100,system_keyspace::topology_requests_entry: Add snapshot info to table,feature,0,0,0
642aa449370ed8fa905bb7615926a915b473491a,Calle Wilund,Tue Feb 3 12:32:19 2026 +0100,topology_state_machine: Add snapshot_tables operation,feature,0,0,0
e3d4493bf61b726c2a3152dd436119522f17874c,Calle Wilund,Wed Jan 28 16:49:49 2026 +0100,topology_coordinator: Break out logic from handle_truncate_table,other,0,0,0
6e39c3bb8326bff360eb8917b66532687f1d0a0e,Calle Wilund,Wed Jan 28 16:37:35 2026 +0100,storage_proxy: Break out logic from request_truncate_with_tablets,other,0,0,0
aba5a8c37fd10dbfd48a895536ba8bcd277af4e8,Marcin Maliszkiewicz,Fri Feb 20 17:03:50 2026 +0100,generic_server: fix waiters count in shed log,bug_fix,0,0,0
51a25c8af3b7edddfbb6472cc5754490748569ef,Botond Dénes,Wed Feb 4 09:12:00 2026 +0200,test/boost/batchlog_manager_test: add tests for v1 batchlog,feature,0,0,0
83344dacbde82e95647dee1be8501b114db6c503,Botond Dénes,Wed Feb 4 09:09:28 2026 +0200,test/boost/batchlog_manager_test: make prepare_batches() work with both v1 and v2,other,0,0,0
