hash,author,date,message,category,logs_added,logs_removed,logs_modified
e5d3c6741f5647d66744177fb7c4528a2f5b716f,Benny Halevy,Wed Nov 29 08:20:20 2023 +0200,api: use locator::topology rather than fb_utilities,other,0,0,0
03fe674314ac8692ed76ca081aec4387d421e169,Benny Halevy,Wed Nov 29 08:20:20 2023 +0200,alternator: ttl: use locator::topology rather than fb_utilities,other,0,0,0
f3e035856376429edbc1212e943436f3b2bf20f8,Benny Halevy,Wed Nov 29 08:20:20 2023 +0200,gossiper: use locator::topology rather than fb_utilities,other,0,0,0
3c846d38013d1e5fe721c72c911b9b425539b72b,Benny Halevy,Wed Nov 29 08:20:20 2023 +0200,init: get_seeds_from_db_config: accept broadcast_address,feature,0,0,0
4d461fc78878991cd9a37cf148563ab28ec90330,Benny Halevy,Thu Nov 30 09:47:13 2023 +0200,locator: replication strategies: use locator::topology rather than fb_utilities,other,0,0,0
86716b2048a550c2e543900c0d03bdb4ea46bd88,Benny Halevy,Wed Nov 29 16:14:49 2023 +0200,locator: topology: add helpers to retrieve this host_id and address,feature,0,0,0
52412087b7564afab41d2841e4500f22de670d07,Benny Halevy,Wed Nov 29 17:03:20 2023 +0200,snitch: pass broadcast_address in snitch_config,feature,0,0,0
c8ee7d4499cb5a15d3e66b51f2e8b6ee24e03791,Patryk Jędrzejczak,Fri Dec 1 12:29:34 2023 +0100,db: make schema commitlog feature mandatory,feature,0,0,0
75a8be5b877af04786ccb567c0fbb378deb26d5f,Calle Wilund,Mon Dec 4 18:51:04 2023 +0000,commitlog.hh: Fix numeric constant for file format version 3 to be actual '3',bug_fix,0,0,0
e94070db648e7ac688805b5bc788063c36915842,Calle Wilund,Mon Dec 4 12:19:31 2023 +0000,commitlog_test: Add test for commit log replay skip past EOF,feature,0,0,0
3a8a3100afcaef11ffc899d5b5d09a69783864a9,Kefu Chai,Mon Dec 4 12:02:41 2023 +0800,raft: add formatter for raft::logical_clock::time_point,feature,0,0,0
60af2f3cb21914f855fd5cc1929629c113b7999b,Avi Kivity,Mon Dec 4 13:59:52 2023 +0200,Merge 'New commitlog file format using tagged pages' from Calle Wilund,feature,0,0,0
8fa2e3ad2ac00a3eeb30c60ab598fe36652630ea,Avi Kivity,Sun Dec 3 17:29:34 2023 +0200,Merge 'Remove sstables::remove_by_toc_name()' from Pavel Emelyanov,other,0,0,0
a8c9451fb2eeac991c5e41477fb39dde4802c9e6,Wojciech Mitros,Thu Nov 9 16:20:07 2023 +0100,commitlog: add max disk size api,feature,0,0,0
030d42193181425a870022548e69c6d807518472,Yaniv Kaul,Sun Dec 3 10:08:11 2023 +0200,Update service/topology_state_machine.hh,other,0,0,0
c658bdb150bc37f18414dbc48ae20af40e2d158b,Yaniv Kaul,Sat Dec 2 22:37:22 2023 +0200,Typos: fix typos in comments,bug_fix,0,0,0
01e54f5b12e72a2976f973d23ae0c61ce19ba914,Kamil Braun,Fri Dec 1 17:11:32 2023 +0100,Merge 'test: delete topology_raft_disabled suite' from Patryk Jędrzejczak,other,0,0,0
de931702ec5fcca013e62a864587833945c39766,Pavel Emelyanov,Thu Nov 30 16:36:46 2023 +0300,sstable_directory: Enlight deletion log replay,other,0,0,0
b10ca96e07cafccfdfd970b3e1e0273c01738d3e,Pavel Emelyanov,Thu Nov 30 14:01:30 2023 +0300,test: Add test case to validate deletion log work,feature,0,0,0
bb167dcca55f0cf4f18133d788ed585a4bc30e13,Pavel Emelyanov,Thu Nov 30 14:23:51 2023 +0300,sstable_directory: Fix indentation after previous patch,bug_fix,0,0,0
28b1289d4be831e869c08304f9d1504e0d05004d,Pavel Emelyanov,Thu Nov 30 14:21:22 2023 +0300,sstable_directory: Coroutinize delete_with_pending_deletion_log(),other,0,0,0
ed043e57622231a82217ab6a132d7fc88c1fa968,Pavel Emelyanov,Thu Nov 30 14:20:45 2023 +0300,sstable_directory: Split delete_with_pending_deletion_log(),other,0,0,0
3ddc1458ee12ea0315c9be666dfd496c17e9aa9d,Gleb Natapov,Thu Nov 30 13:34:58 2023 +0200,storage_service: topology coordinator: ignore abort_requested_exception in background fibers,other,0,0,0
8ed8b151da732260e2d6322839cffb5b497103ab,Gleb Natapov,Thu Nov 30 11:10:26 2023 +0200,storage_service: fix de-initialization order between storage service and group0_service,bug_fix,0,0,0
77c4ee92e5d587a1a2925d7ab17cdc578296a8bf,Patryk Jędrzejczak,Fri Nov 24 17:03:27 2023 +0100,test: delete topology_raft_disabled suite,other,0,0,0
ba990d90bb69e3161dab953b1bf06989d0f4947c,Patryk Jędrzejczak,Fri Nov 24 17:02:13 2023 +0100,test: topology_raft_disabled: move tests to topology_custom suite,other,0,0,0
659ac9c7f588002378548e8111fb0dddcb0c6eaa,Patryk Jędrzejczak,Fri Nov 24 16:16:18 2023 +0100,test: topology_raft_disabled: move utils to topology suite,other,0,0,0
684b070b201709277088065ef21fbeb47104718f,Patryk Jędrzejczak,Fri Nov 24 11:30:34 2023 +0100,test: topology_raft_disabled: use consistent cluster management,other,0,0,0
1059fece199b4896d6edd9b7fee89e5e9551b809,Patryk Jędrzejczak,Fri Nov 24 15:56:33 2023 +0100,test: topology_raft_disabled: add new util functions,feature,0,0,0
7e43ebf88e1cfc1c6d0ee589888c1991825ffeaa,Patryk Jędrzejczak,Fri Nov 24 11:13:30 2023 +0100,test: topology_raft_disabled: delete test_raft_upgrade_no_schema,other,0,0,0
5fd30578d74ba94ca4a132924c170cd41ae590dc,Piotr Smaroń,Sun Nov 26 00:17:51 2023 +0100,config: introduce value_status::Deprecated,other,0,0,0
8e9d3af431239b7da6bd754c15f44096e55bf665,Avi Kivity,Wed Nov 29 20:55:53 2023 +0200,Merge 'Commitlog: complete prerequisites and enforce hard limit by default' from Eliran Sinvani,other,0,0,0
8a14839a000008e86a14ad6e2568ebc799748aad,Kamil Braun,Wed Nov 29 19:02:35 2023 +0100,Merge 'handle more failures during topology operations' from Gleb,other,0,0,0
3b70fde3cdaca24f8aa007a193673b86a7054f3b,Calle Wilund,Tue Nov 28 19:42:20 2023 +0000,commitlog: Make named_files in delete_segments have updated size,other,0,0,0
3ed6925673dea88a5fe157f6239b98d60ec1690a,Botond Dénes,Wed Nov 29 08:48:40 2023 +0200,Merge 'Major compaction: flush commitlog by forcing new active segment and flushing all tables' from Benny Halevy,feature,0,0,0
e68e998b153bc95a7db96ba6fe712728ee4e6d26,Gleb Natapov,Sun Nov 26 11:21:18 2023 +0200,test: add test to check errro handling during tablet draining,feature,0,0,0
b1c0b57acf0e72a9bfc71894f19509f303d09146,Gleb Natapov,Mon Nov 27 14:26:04 2023 +0200,test: fix test_topology_streaming_failure test to not grep the whole file,bug_fix,0,0,0
4ebdddc31b091ed22237309bbdb2d2936754c64d,Gleb Natapov,Tue Nov 21 14:16:40 2023 +0200,storage_service: topology coordinator: rollback on handle_tablet_migration failure during tablet_draining stage,other,0,0,0
15d3ed4357931ee3fc48d76d60fcb89ecee23195,Patryk Jędrzejczak,Mon Nov 20 12:33:57 2023 +0100,test: topology: update run_first lists,other,0,0,0
1f56962591240712b7892395577307797f96a6a2,Kamil Braun,Fri Nov 24 12:41:05 2023 +0100,Merge 'test: topology: test concurrent bootstrap' from Patryk Jędrzejczak,other,0,0,0
a8d06aa9fdbe699893b049568077b401fad8fc1e,Patryk Jędrzejczak,Fri Nov 17 15:26:40 2023 +0100,test: topology: add test_concurrent_bootstrap,feature,0,0,0
35bb025f99fa04ee482c8c0de7e0fb1000f1aca7,Kamil Braun,Thu Sep 7 19:24:07 2023 +0200,test/pylib: log_browsing: fix type hint,bug_fix,0,0,0
7267376eac3ff7d9431a6283edd098e2c5572aef,Gleb Natapov,Mon Nov 6 13:47:23 2023 +0200, storage_service: topology coordinator: do not retry the metadata barrier forever in write_both_read_new state,feature,0,0,0
7ea8fa459cbf647fb227af193fdec7807907a6e8,Gleb Natapov,Tue Nov 7 11:19:58 2023 +0200,storage_service: topology coordinator: do not retry the metadata barrier forever in left_token_ring state,other,0,0,0
11b7ee32ec10ed86888a4484396205bc5d160462,Gleb Natapov,Tue Nov 7 15:49:12 2023 +0200,storage_service: topology coordinator: return a node that is being removed from get_excluded_nodes,other,0,0,0
4c76b8b59f48832a6309c9b7efbbddb7ab419d04,Gleb Natapov,Thu Nov 16 17:22:17 2023 +0200,storage_service: topology_coordinator: use new rollback_to_normal state in the rollback procedure,feature,0,0,0
95dd0e453da2a90c9c665ec37879b1c80e7751ae,Gleb Natapov,Thu Nov 16 17:15:12 2023 +0200,storage_service: topology coordinator: add rollback_to_normal node state,feature,0,0,0
c58ff554d89f4b1829308692857d6fa0ab4b98e0,Piotr Dulikowski,Thu Nov 23 00:14:59 2023 +0100,raft: rpc: introduce destination_not_alive_error,other,0,0,0
03ecc8457c8535e78daac6e4317978a74439faa8,Kamil Braun,Thu Nov 23 10:31:58 2023 +0100,Merge 'raft topology: reject replace if the node being replaced is not dead' from Patryk Jędrzejczak,other,0,0,0
2f7f4ebb741c65200da1e2045a6ae4ef2858b5b7,Pavel Emelyanov,Fri Nov 17 17:25:58 2023 +0300,raft_state_machine: Check system.topology presense before tying to find it,other,0,0,0
bfa839ce928e0f3c91e4ec0f040f2993002d3e35,Eliran Sinvani,Tue Jul 5 16:34:12 2022 +0300,commitlog: enforce commitlog size hard limit by default,other,0,0,0
63d62a7db26826a1c8ed29041c2fcb3db9f15ce3,Eliran Sinvani,Tue Jul 5 16:29:05 2022 +0300,commitlog: set flush threshold to half of the  limit size,other,0,0,0
d2a8651bce545a76c19acc8870d3362b4f3da9a3,Eliran Sinvani,Tue Jul 5 16:25:10 2022 +0300,commitlog: unfold flush threshold assignment,other,0,0,0
bf7a67224cb55daea737c6ee76e349e62b5565f5,Patryk Jędrzejczak,Mon Nov 6 10:10:24 2023 +0100,raft topology: reject replace if the node being replaced is not dead,other,0,0,0
94ffdb47921c11c792a0daac4ab956574abd9a6b,Patryk Jędrzejczak,Mon Nov 6 10:09:38 2023 +0100,raft topology: add the gossiper ref to topology_coordinator,feature,0,0,0
7062ff145ed08dfb054bba6dd0649e00264dd9a7,Patryk Jędrzejczak,Tue Nov 21 11:55:22 2023 +0100,test: move test_replace to topology_custom,other,0,0,0
9775b1c12dc5c31f9a6d87f071f1d54b323d5edf,Patryk Jędrzejczak,Fri Nov 17 14:16:33 2023 +0100,test: server_add: wait until the node being replaced is dead,feature,0,0,0
ee45a1c43064e966e46d45a7d61dc28971015d63,Patryk Jędrzejczak,Thu Nov 9 17:33:25 2023 +0100,raft topology: join: delay advertising replacing node if it reuses IP,other,0,0,0
c0e4b8e9c035ebe706bc8ce913f3fab51ab6da6c,Patryk Jędrzejczak,Mon Nov 6 16:35:41 2023 +0100,raft topology: join: fix a condition in validate_joining_node,bug_fix,0,0,0
33fba2826511051bb29f39e5d1a0db8f618a6dd2,Calle Wilund,Mon Oct 9 11:38:32 2023 +0000,commitlog_test: Add test for replaying large-ish mutation,feature,0,0,0
0d41769daad740167e9074a999ac78a387ecf02e,Calle Wilund,Mon Sep 25 14:43:57 2023 +0000,commitlog_test: Add additional test for segmnent truncation,feature,0,0,0
57a4645c81eac4de8918f97e5be8e36df415bc21,Calle Wilund,Mon Sep 25 13:41:31 2023 +0000,docs: Add docs on commitlog format 3,feature,0,0,0
6b66daabfc77726cb8815fafebb0253dc5188657,Calle Wilund,Mon Sep 25 13:40:57 2023 +0000,commitlog: Remove entry CRC from file format,other,0,0,0
e29bf6f9e82305923fe44839a156b0de8af60e44,Calle Wilund,Wed Sep 20 13:46:15 2023 +0000,commitlog: Implement new format using CRC:ed sectors,feature,0,0,0
18e79d730eb136ea625e21fe4e8f30b4b5a0422b,Calle Wilund,Wed Sep 20 13:44:16 2023 +0000,commitlog: Add iterator adaptor for doing buffer splitting into sub-page ranges,feature,0,0,0
862f4f2ed30e7d86b017f3ce8c3ca2a0f52ebb54,Calle Wilund,Tue Sep 19 08:39:18 2023 +0000,commitlog_replayer: differentiate between truncated file and corrupt entries,other,0,0,0
6ffb482bf3b86f4c6edad1f1eb0c922016693abe,Calle Wilund,Mon Sep 4 12:59:34 2023 +0000,Commitlog replayer: Range-check skip call,other,0,0,0
6edbf4b66301cc6d1b0bd926e67a3400cdcae486,Gleb Natapov,Wed Nov 8 17:30:04 2023 +0200,storage_service: topology coordinator: put fence version into the raft state,other,0,0,0
f9eb64b8e07578b9ce003a3958c1bd4b52dbdd19,Michał Chojnowski,Tue Oct 31 15:10:03 2023 +0100,cache_flat_mutation_reader: fix a logic bug in ensure_population_lower_bound() with reverse reads,bug_fix,0,0,0
f04e890690e0a6788e6261c37aa94aad81475406,Gleb Natapov,Mon Nov 6 15:50:44 2023 +0200,storage_service: topology coordinator: do fencing even if draining failed,other,0,0,0
9212bdc6b159b981cfeb5afd998305217944cbb4,Kamil Braun,Thu Nov 9 16:18:04 2023 +0100,migration_manager: more verbose logging for schema versions,logging_improvement,0,0,0
dc6a0b2c35b8b556697a30437bd1c7b3f08810ce,Tomasz Grabiec,Wed Nov 8 23:21:53 2023 +0100,gossiper: Elevate logging level for node restart events,logging_improvement,0,0,0
d24b305712d7712d1b77992f8520d15e073ebdc2,Kamil Braun,Mon Nov 13 15:02:27 2023 +0100,Merge 'raft topology: join: do not time out waiting for the node to be joined' from Patryk Jędrzejczak,other,0,0,0
2d7bfeb3fa9f137264883161ff2399a41bf3da75,Patryk Jędrzejczak,Fri Nov 3 10:40:48 2023 +0100,raft topology: fix indentation,bug_fix,0,0,0
e94c7cff28e5ef19354a77f97f1b536fbfc137c2,Patryk Jędrzejczak,Fri Nov 3 14:33:15 2023 +0100,raft topology: join: try sending the response only once,other,0,0,0
4ffa692cb3b790a63a87f31c93351a3f67444484,Patryk Jędrzejczak,Fri Nov 3 11:33:39 2023 +0100,raft topology: join: do not time out waiting for the node to be joined,other,0,0,0
2dd8152c8ba4fa63b24ecc90d73aeb3e81d37a9f,Gleb Natapov,Wed Nov 8 18:00:34 2023 +0200,storage_service: topology coordinator: log rollback event before changing node's state,other,0,0,0
f094e23d84930df0012c0290420b504925b4e2dd,Kamil Braun,Fri Oct 6 17:37:34 2023 +0200,system_keyspace: use system memory for `system.raft` table,other,0,0,0
07e9522d6c630de43999b58eb7103fbe82a396d0,Kamil Braun,Tue Nov 7 17:17:49 2023 +0100,Merge 'raft topology: handle abort exceptions better in fence_previous_coordinator' from Piotr Dulikowski,other,0,0,0
85516c9155a8f4a438d8014890339ff6ed7027f6,Piotr Dulikowski,Mon Nov 6 11:39:04 2023 +0100,raft topology: catch and abort on exceptions from topology_coordinator::run,other,0,0,0
843f02eb5dd1cdce5a8f1ef73c9ae3352ed52e31,Piotr Dulikowski,Mon Nov 6 11:29:15 2023 +0100,"Revert ""storage_service: raft topology: mark topology_coordinator::run function as noexcept""",other,0,0,0
41c2dac250f3a53a8a47b41ed735d87e3821eed7,Piotr Dulikowski,Sat Nov 4 16:39:05 2023 +0100,raft topology: don't print an error when fencing previous coordinator is aborted,other,0,0,0
1408b7cfa8d30760c36ab70467be4f6f330ef855,Piotr Dulikowski,Sat Nov 4 16:34:20 2023 +0100,raft topology: handle abort exceptions from sleeping in fence_previous_coordinator,other,0,0,0
6cc5bcae801d2e1298870acd3b3432fbb6aa3c57,Kamil Braun,Fri Nov 3 11:40:29 2023 +0100,test: test_topology_ops: disable background writes,other,0,0,0
2b2302d3730b308bf497b999c2539bbf26526278,Asias He,Thu Nov 2 10:08:15 2023 +0800,streaming: Ignore dropped table on both sides,other,0,0,0
5cf18b18b227fbdc88730b3302e9258bfa8037b0,Kamil Braun,Thu Nov 2 16:44:18 2023 +0100,"Merge 'raft: topology: outside topology-on-raft mode, make sure not to use its RPCs' from Piotr Dulikowski",other,0,0,0
e2894a081a2151a64741e8118a000f0563dce422,Patryk Jędrzejczak,Thu Oct 26 15:51:58 2023 +0200,table_helper: add logger,feature,0,0,0
0846d324d7a8ef224dc7fb39e50502d63544240f,Kamil Braun,Thu Nov 2 10:15:45 2023 +0100,Merge 'rollback topology operation on streaming failure' from Gleb,other,0,0,0
190d549bd51aaf49eb8ff743b846ab58b7876098,Piotr Dulikowski,Tue Oct 31 13:02:26 2023 +0100,raft: topology: only register verbs in topology-on-raft mode,other,0,0,0
8727634e9cc26faf7ba326ec87c8798f7f5d9df9,Piotr Dulikowski,Tue Oct 31 13:00:52 2023 +0100,raft: topology: only pull topology snapshot in topology-on-raft mode,other,0,0,0
b974d8ca1b6cac088379eee5d7231baad4462cbb,Pavel Emelyanov,Tue Oct 31 10:43:55 2023 +0300,stream_session: Do not print banign exceptions with error level,other,0,0,0
e71409df388735d7b17b4d5b26acdff9cf9acaf9,Pavel Emelyanov,Wed Oct 25 15:04:18 2023 +0300,table_for_tests: Get compaction manager from table,other,0,0,0
cba8f633f182c7719f95f2e6173e47adb45269ba,Pavel Emelyanov,Wed Oct 25 19:25:21 2023 +0300,tests: Split the compaction backlog test case,other,0,0,0
384427bd02f8890978eda0f9ddac46035cb60179,Paweł Zakrzewski,Thu Oct 26 11:47:34 2023 +0200,doc: Replace instances of SimpleStrategy with NetworkTopologyStrategy,other,0,0,0
f08e7aad6191a632e0f63726d98d3320b834da98,Wojciech Mitros,Mon Jul 10 15:55:15 2023 +0200,test: account for multiple flushes of commitlog segments,other,0,0,0
1c0ae2e7efd4ba925224d80c601f70a4f21a5e64,Kamil Braun,Thu Oct 26 13:05:21 2023 +0200,Merge 'raft topology: assign tokens after join node response rpc' from Piotr Dulikowski,other,0,0,0
020a9c931be5a63344bcb83673006502eeca0bfe,Marcin Maliszkiewicz,Wed Oct 25 19:46:52 2023 +0200,db: view: run local materialized view mutations on a separate smp service group,other,0,0,0
a6236072eefe67e1f2810b5ec3d68fc09b393992,Patryk Jędrzejczak,Thu Oct 19 16:12:30 2023 +0200,raft topology: join_node_request_handler: wait until first node becomes normal,other,0,0,0
b878dcc1c3e4fc9c10b02bdd4948759f67c439e2,Botond Dénes,Wed Oct 25 06:13:58 2023 -0400,tools/scylla-nodetool: log responses with trace level,logging_improvement,0,0,0
ba044b769a0f97dda6ed2038bbc1503f9b1434b2,Gleb Natapov,Sun Oct 15 17:19:25 2023 +0300,storage_service: raft topology: remove code duplication from global_tablet_token_metadata_barrier,other,0,0,0
72419f1a6138e42672e94e851e8d7c5b3eff95df,Gleb Natapov,Tue Sep 26 16:06:48 2023 +0300,tests: add tests for streaming failure in bootstrap/replace/remove/decomission,feature,0,0,0
cee7aab32cc7521a7565f0823ed039fd500496b5,Gleb Natapov,Thu Sep 28 13:31:12 2023 +0300,"storage_service: raft topology: fix typo in ""decommission"" everywhere",bug_fix,0,0,0
0201304096c03e328cc875c8082d41d1216609c4,Gleb Natapov,Thu Sep 21 10:58:58 2023 +0300,storage_service: raft topology: add streaming error injection,feature,0,0,0
ba217d934152782eefc6d05fea3f67aae2833f6f,Gleb Natapov,Wed Sep 20 10:51:27 2023 +0300,storage_service: raft topology: do not increase topology version during CDC repair,other,0,0,0
8e393ea750dd1d1fb2c817e74c23c37ccd3e12de,Gleb Natapov,Tue Sep 5 15:29:03 2023 +0300,storage_service: raft topology: rollback topology operation on streaming failure.,other,0,0,0
0a8c3e5c782d6270088888e53a482998b2c0d1c2,Gleb Natapov,Thu Oct 19 17:05:30 2023 +0300,storage_service: raft topology: load request parameters in left_token_ring state as well,other,0,0,0
49b6153d27dbdf5d3a530e4ae8db8ee0fa3dc4f3,Gleb Natapov,Wed Sep 20 11:13:18 2023 +0300,storage_service: raft topology: do not report term_changed_error during global_token_metadata_barrier as an error,other,0,0,0
5b760572dfeeccdc34654d820cffb3080340cd64,Gleb Natapov,Wed Sep 20 11:01:27 2023 +0300,storage_service: raft topology: change global_token_metadata_barrier error handling to try/catch,other,0,0,0
466fe3547459403046756dc82cba95ab4543f942,Gleb Natapov,Thu Sep 7 16:46:06 2023 +0300,storage_service: raft topology: make global_token_metadata_barrier node independent,other,0,0,0
a49ae3ff875efaaf7d6ccd31bb99f0b56518c0f4,Gleb Natapov,Thu Sep 7 16:45:20 2023 +0300,storage_service: raft topology: split get_excluded_nodes from exec_global_command,other,0,0,0
897a7e599aedfefd9727896edd9613ce8e940380,Gleb Natapov,Tue Sep 5 15:37:18 2023 +0300,storage_service: raft topology: drop unused include_local and do_retake parameters from exec_global_command which are always true,other,0,0,0
7f1aa41e86f90ce9fa99c528d3fb46aa133691f3,Gleb Natapov,Mon Sep 4 14:02:39 2023 +0300,storage_service: raft topology: simplify streaming RPC failure handling,refactor,0,0,0
a3ba4b31098074a24ce1b3c941341a5375dbbe14,Piotr Dulikowski,Tue Oct 17 15:16:15 2023 +0200,test: test_topology_ops: continuously write during the test,other,0,0,0
63aa9332aae291b46bd7fdb6a71d8fdde1a56c1a,Piotr Dulikowski,Mon Oct 16 15:31:31 2023 +0200,raft topology: assign tokens after join node response rpc,other,0,0,0
2d161676c750a41d2f9531b777541e15fa0ad76f,Piotr Dulikowski,Mon Oct 16 15:26:16 2023 +0200,raft topology: loosen assumptions about transition nodes having tokens,other,0,0,0
e4162227ff0b3e0f79100ef3a1ff0b4ecd1e39d7,Pavel Emelyanov,Tue Oct 24 14:14:03 2023 +0300,system_keyspace: Tune up status change trace message,logging_improvement,0,0,0
e4c0a4d34d12f6fec3a8017630b84bdcff8aadf7,Pavel Emelyanov,Tue Oct 24 17:30:05 2023 +0300,api: Move storage_service endpoints that use token metadata only,other,0,0,0
2a21029ff5e44892ecf51e1803fa10207ce4bc5c,Kamil Braun,Tue Oct 24 12:16:36 2023 +0200,Merge 'make topology_coordinator::run noexcept' from Gleb,other,0,0,0
dcaaa74cd4d72b075871cd154a81355fb04411ee,Gleb Natapov,Mon Oct 23 13:30:37 2023 +0300,storage_service: raft topology: mark topology_coordinator::run function as noexcept,other,0,0,0
65bf5877e78612006ab898dad458b02ed38d61b6,Gleb Natapov,Mon Oct 23 13:03:17 2023 +0300,storage_service: raft topology: do not throw error from fence_previous_coordinator(),other,0,0,0
ee9cc450d4242fcf3bb39eeb8dc3121ee46231d3,Avi Kivity,Thu Aug 24 12:37:02 2023 +0300,logalloc: report increases of reserves,other,0,0,0
899ecaffcd3e6434252074e3f307da3fc3b9d5d1,Tomasz Grabiec,Thu Oct 19 12:36:14 2023 +0200,test: tablets: Enable for verbose logging in test_tablet_metadata_propagates_with_schema_changes_in_snapshot_mode,logging_improvement,0,0,0
c1486fee40cec4ed7df18c987a39b804b5545cc7,Kamil Braun,Wed Oct 18 11:14:31 2023 +0200,Merge 'commitlog: drop truncation_records after replay' from Petr Gusev,other,0,0,0
f42eb4d1ce321e93b934ce23e128af29d23d66f8,Avi Kivity,Tue Oct 17 18:27:43 2023 +0300,Merge 'Store and propagage GC timestamp markers from commitlog' from Calle Wilund,other,0,0,0
a0aee54f2c21139afa760c5f93bf3b71348543ba,Petr Gusev,Wed Sep 27 12:48:19 2023 +0400,add test_commitlog,feature,0,0,0
dde36b5d9dace7265a9d5b48a7c7c7492bdb78ed,Petr Gusev,Fri Sep 22 13:40:27 2023 +0400,main.cc: flush only local memtables when replaying schema commitlog,other,0,0,0
54dd7cf1da7bf2f5a0d77edee7641d34e942d112,Petr Gusev,Fri Sep 22 11:45:43 2023 +0400,main.cc: drop redundant supervisor::notify,other,0,0,0
c89ead55ff1ee90158bedd81f58cca2e099dcab5,Petr Gusev,Thu Sep 21 23:12:59 2023 +0400,system_keyspace: flush if schema commitlog is not available,other,0,0,0
3378c246f7edc4dc94e430c56a8000bf230ea8c9,Calle Wilund,Tue Aug 15 16:49:57 2023 +0000,main/cql_test_env: Augment compaction mgr tombstone_gc_state with CL GC info,other,0,0,0
560d3c17f026ee8c791a39ebb629885e1e54d904,Calle Wilund,Tue Aug 15 15:21:09 2023 +0000,commitlog: Add keeping track of approximate lowest GC clock for CF entries,feature,0,0,0
2429cf656c30706a2c1923ff0e0d9ddb21df24ff,Calle Wilund,Tue Aug 1 13:07:49 2023 +0000,database: Force new commitlog segment on user initiated flush,feature,0,0,0
810d06946f95dc9683dafcd0f369b7e2d1443e0f,Calle Wilund,Tue Aug 1 13:06:18 2023 +0000,commitlog: Add helper to force new active segment,feature,0,0,0
9b1dfad51c4a60de44d41722aaa204a6f855a83a,Petr Gusev,Mon Oct 16 14:59:49 2023 +0400,main.cc: disable stall detector for debug ARM builds,bug_fix,0,0,0
22bf3c03df51d6fd84f033b3e1350ad835042c58,Aleksandra Martyniuk,Wed Jul 26 15:33:00 2023 +0200,compaction: add compaction_progress_monitor,feature,0,0,0
accac7efd839368a32e43317be5611c6c147a98a,Tomasz Grabiec,Wed Oct 11 17:33:20 2023 +0200,test: test_tablets.py: Enable verbose logging,logging_improvement,0,0,0
940e44f887741802f33481055d5920346e3b0e27,Jan Ciolek,Thu Oct 5 13:55:36 2023 +0200,db/view: change log level of failed view updates to WARN,logging_improvement,0,0,0
35849fc901cb2d70f6aa18a590c0963ded17d1b7,Avi Kivity,Wed Oct 11 00:32:05 2023 +0300,"Revert ""Merge 'Don't calculate hashes for schema versions in Raft mode' from Kamil Braun""",other,0,0,0
4e6fe3450137909f0bcf969815fb1a84d2d8d2dc,Raphael S. Carvalho,Fri Oct 6 15:04:59 2023 -0300,tests: Synchronize boost logger for multithreaded tests in sstable_directory_test,other,0,0,0
7862ffbd14ea8b53e85176fea42284910a3ce84f,Tomasz Grabiec,Fri Oct 6 23:48:25 2023 +0200,perf_simple_query: Allow running with tablets,other,0,0,0
3c0d723ad4dc2f63865887e41b4effa2fc53c980,Tomasz Grabiec,Fri Oct 6 22:22:01 2023 +0200,test: cql_test_env: Initialize node state in topology,other,0,0,0
aa38ea3642e391c0e223a0510325076f5ddc3fee,Dawid Medrek,Mon Oct 2 17:29:03 2023 +0200,db/hints/manager: Unfriend space_watchdog,other,0,0,0
09eb30e6f14474cf00498d838a44120b61231665,Dawid Medrek,Mon Oct 2 16:46:54 2023 +0200,db/hints: Coroutinize drain_for(),other,0,0,0
f1f35ba8195854d28f28ec3fd1938d132950b60f,Dawid Medrek,Sun Oct 1 21:03:13 2023 +0200,db/hints: Let drain_for() return a future,other,0,0,0
1c70a18fc7c0d61f8d58e4db01f22e0f78142c43,Dawid Medrek,Fri Sep 29 18:56:42 2023 +0200,db/hints: Use manager as API for hint_endpoint_manager,other,0,0,0
d3bc0d47e0863b47daee41c568c54f35de7e368d,Kamil Braun,Thu Oct 5 17:42:03 2023 +0200,test/pylib: always return data as JSON from endpoints,other,0,0,0
9f215d3cf18b9263f813a529e21bcc870154bae8,Dawid Medrek,Fri Sep 29 16:56:21 2023 +0200,db/hints: Change the order of logging in ensure_created_and_verified(),logging_improvement,0,0,0
d0b4d9f14f03da3ab4b18a006947b3c94899e724,Dawid Medrek,Fri Sep 29 16:46:24 2023 +0200,db/hints: Move the implementation of directory_initializer,feature,0,0,0
2d4f157216af83168f04c62a64d770e88b8c776e,Kamil Braun,Thu Oct 5 17:58:35 2023 +0200,test/pylib: scylla_cluster: catch `HTTPError` in topology change endpoints,other,0,0,0
e600f35d1e217c88851486f2de5110fe4564047a,Avi Kivity,Thu Oct 5 19:47:21 2023 +0300,"Merge 'logalloc, reader_concurrency_semaphore: cooperate on OOM kills' from Botond Dénes",other,0,0,0
32a19fd61be675d13aa5587e5e0cce8f9288c7b8,Petr Gusev,Wed Sep 27 23:15:18 2023 +0400,database: add_column_family: rename readonly parameter to is_new,feature,0,0,0
b70bca71bceb209357fdfa531326d0a4e5438d76,Petr Gusev,Thu Oct 5 13:09:14 2023 +0400,system_keyspace: move load_truncation_times into distributed_loader::populate_keyspace,other,0,0,0
1efabca51591d8824e3c39824f4cbca49c44cc82,Botond Dénes,Fri Sep 29 06:43:35 2023 -0400,tools/scylla-nodetool: implement the traceprobability commands,feature,0,0,0
9711bfde1167a1a123266db19275290c26346240,Petr Gusev,Wed Sep 27 21:46:44 2023 +0400,commitlog_replayer: refactor commitlog_replayer::impl::init,refactor,0,0,0
b68d6ad5e971411357fdcc7939eccd5c2ccfbdfa,Kamil Braun,Fri Sep 29 14:57:45 2023 +0200,api: storage_service: unset `reload_raft_topology_state`,other,0,0,0
fdecea548074c7a709a816dec92747ee160fbdcf,Botond Dénes,Fri Sep 22 07:58:43 2023 -0400,tools/scylla-nodetool: log more details for failed requests,other,0,0,0
1640f83fdc31959ff64f910aaa67b6af536967ca,Michael Huang,Mon Sep 25 08:17:33 2023 -0400,raft: Store snapshot update and truncate log atomically,other,0,0,0
