hash,author,date,message,category,logs_added,logs_removed,logs_modified
9079c98db0b2cac852e8e90492790cb34b1ea9e2,Benny Halevy,Wed Jun 22 10:04:23 2022 +0300,compaction_manager: offstrategy_compaction_task: refactor log printouts,refactor,0,0,0
34e93915872ac09a17ec69376509e6d3a47dffdf,Benny Halevy,Tue Jun 21 19:40:00 2022 +0300,test: sstable_compaction: compaction_manager_for_testing,other,0,0,0
13a5022499ff30934ebad77b1bd988b1fc0ad994,Piotr Dulikowski,Wed Jun 22 14:32:56 2022 +0200,database: add stats for per partition rate limiting,feature,0,0,0
1e4e92ed8b48a2f9bc3e985ff6941316febed240,Piotr Dulikowski,Wed May 4 00:54:25 2022 +0200,storage_proxy: add allow rate limit flag to mutate_begin,feature,0,0,0
2a7ba76c3e6c1d0da87146abfac2f89d95d3a9c8,Piotr Dulikowski,Thu May 19 09:19:13 2022 +0200,storage_proxy: resultize return types of write handler creation path,other,0,0,0
cc9a2ad41fadb5e77adcad4f3651cc5e9d6b03b7,Piotr Dulikowski,Mon May 16 10:57:30 2022 +0200,database: apply per-partition rate limiting for reads/writes,other,0,0,0
51546b0609b0d9e433e122bfe11270c0ccb6c41a,Piotr Dulikowski,Mon May 16 18:55:59 2022 +0200,storage_proxy: pass rate_limit_exception through write RPC,other,0,0,0
f0cafc35fd41c1383d047d889b8fb682c60f513f,Pavel Emelyanov,Fri Jun 17 17:02:35 2022 +0300,proxy stats: Get rack/datacenter from topology,other,0,0,0
8ffe2494305aecce4b4f59ae9f6732049f47e3a4,Pavel Emelyanov,Fri Jun 17 17:11:37 2022 +0300,proxy stats: Push topology arg to get_ep_stats,other,0,0,0
3ab7c9320c0454a1d34710bc38c74afe8ea208f7,Pavel Emelyanov,Fri Jun 17 16:54:06 2022 +0300,api: Get rack/datacenter from topology,other,0,0,0
9b6312687b3130a9bbdc4f851aa2219b32dd6c2c,Pavel Emelyanov,Fri Jun 17 16:36:08 2022 +0300,hints: Get rack/datacenter from topology,other,0,0,0
98a4d41e316048cce548ef7d7994faf01bafc61d,Pavel Emelyanov,Fri Jun 17 16:23:22 2022 +0300,alternator: Get rack/datacenter from topology,other,0,0,0
5e2fa32c8c2f25ba1a55658c23cd7fba114c3af4,Pavel Emelyanov,Fri Jun 17 16:17:00 2022 +0300,range_streamer: Get rack/datacenter from topology,other,0,0,0
b28db0294cd643fdf8ec98793e0262a9006861ec,Pavel Emelyanov,Fri Jun 17 15:55:04 2022 +0300,repair: Get rack/datacenter from topology,other,0,0,0
17128eb54b661709ff35e0b2225c94166e67b898,Pavel Emelyanov,Fri Jun 17 15:46:59 2022 +0300,view: Get rack/datacenter from topology,other,0,0,0
894cbeacc554648f37c516e34897e3069c123bd4,Pavel Emelyanov,Fri Jun 17 15:19:22 2022 +0300,storage_service: Get rack/datacenter from topology,other,0,0,0
507db73586cc5b6ce9e24de326e711d4e7535d70,Pavel Emelyanov,Fri Jun 17 15:16:29 2022 +0300,proxy: Get rack/datacenter from topology,other,0,0,0
b6f7c8da8b7317d6b9ec36260791cc1fb34a7ede,Pavel Emelyanov,Fri Jun 17 14:51:11 2022 +0300,topology: Add get_rack/_datacenter methods,feature,0,0,0
8b4971820343a7948b4df51734dc242a08ef945a,Calle Wilund,Tue May 24 12:59:05 2022 +0000,commitlog: Add (internal) measurement of byte rates add/release/flush-req,feature,0,0,0
6921210bf536d779a72070e1a26e9c46aa251b0b,Calle Wilund,Mon May 23 14:14:17 2022 +0000,commitlog: Add counters for # bytes released/flush requested,feature,0,0,0
336383c87ee6f1740dcd7358a7ba5edf2c406318,Calle Wilund,Tue May 24 12:52:57 2022 +0000,commitlog: Keep track of last flush high position to avoid double request,other,0,0,0
c904b3cf35018a35974a5fceb711d3a9d470c59c,Calle Wilund,Mon May 23 14:13:07 2022 +0000,commitlog: Fix counter descriptor language,bug_fix,0,0,0
f15a6ce41a07b216a09af692062185f7cb022ec7,Raphael S. Carvalho,Wed Jun 15 19:36:57 2022 -0300,tests: Introduce optional RNG seed for boost suite,other,0,0,0
85263b2d024674055fb88bf628ff7b6ed615470c,Pavel Emelyanov,Thu Jun 16 12:42:24 2022 +0300,trace-state: Remove unused fields,logging_improvement,0,0,0
0c8abca75e05131b5140b60feaa54cfd12e75dd8,Pavel Emelyanov,Fri Jun 10 14:43:08 2022 +0300,compaction_manager: Introduce compaction_manager::config,other,0,0,0
997a34bf8c553c87517a8f0b386ea73fbd9eabcf,Pavel Emelyanov,Fri Jun 10 14:36:02 2022 +0300,backlog_controller: Generalize scheduling groups,other,0,0,0
0fef2e02732b7120eeb1842332d343e359fbfe26,Pavel Emelyanov,Fri Jun 10 14:22:51 2022 +0300,compaction_manager: Swap groups and controller,other,0,0,0
0662036d275dbb886d26d8f4beafae5abcb1df20,Pavel Emelyanov,Fri Jun 10 14:13:37 2022 +0300,compaction_manager: Unify scheduling_group structures,other,0,0,0
41f1044d3c965125483bf1c24532408b07b8cf41,Pavel Emelyanov,Thu Jun 9 13:59:00 2022 +0300,compaction_manager: Merge static/dynamic constructors,other,0,0,0
b19b8c9e5bfc61757a09a24683cca57916b897da,Pavel Emelyanov,Fri Jun 10 18:38:19 2022 +0300,compaction_manager: Remove try-catch around logger,other,0,0,0
2734c7080345e39342865c268b686f8161650f8f,Botond Dénes,Thu Jun 16 08:55:05 2022 +0300,Merge 'Batchlog replay for decommission fix and cleanup' from Asias He,bug_fix,0,0,0
b5684aa96dfd4d75afb88c2a0f74daaa91cd0194,Mikołaj Sielużycki,Mon Apr 25 14:06:06 2022 +0200,random_mutation_generator: Add option to specify ks_name and cf_name,feature,0,0,0
6f4bfea9943189409d6837cd7503292aa3f8691d,Asias He,Wed Jun 15 08:28:06 2022 +0800,storage_service: Remove obsolete log,other,0,0,0
2b92d96c87e8d8a245fec96f6c21047b8316f14a,Konstantin Osipov,Thu Jun 2 21:08:03 2022 +0300,test.py: proper suite name in the log,other,0,0,0
f8a8fe41d6d96bc4eb890271bac92434c8ce8c77,Botond Dénes,Fri Jun 10 10:12:19 2022 +0300,cdc/log.hh: expose is_log_name(),other,0,0,0
1c8c693ff74404c9b9c377ac1715539c357c7e2f,Botond Dénes,Fri Jun 10 09:21:13 2022 +0300,"Merge ""Redefine Leveled compaction backlog"" from Raphael S. Carvalho",other,0,0,0
079283193acae090b5d387d1469287ce393637b7,Raphael S. Carvalho,Wed May 11 22:22:39 2022 -0300,tests: sstable_compaction_test: Adjust controller unit test for LCS,other,0,0,0
b27a1d88fe4fcca662b7c1bb1b04298233aa206f,Raphael S. Carvalho,Wed May 11 00:17:16 2022 -0300,compaction: Redefine Leveled compaction backlog,other,0,0,0
05a8d382b6fff5914f33de6b5826c22d48dcea09,Asias He,Thu Jun 9 10:02:59 2022 +0800,storage_service: Do not call do_batch_log_replay again in unbootstrap,other,0,0,0
29c3f10ee4f4a9624084ad8313bfa7b153ce23e2,Asias He,Thu Jun 9 09:45:53 2022 +0800,storage_service: Add log for start and stop of batchlog replay,feature,0,0,0
029508b77ce2732c5a3be579cebfad6e530198e7,Michael Livshin,Tue May 24 18:28:12 2022 +0300,flat_mutation_reader ist tot,other,0,0,0
b288cc4f9fc9edce4eadb60f75f978e718138fc1,Michael Livshin,Mon May 30 16:52:19 2022 +0300,tests: remove some to-become-pointless reader downgrade tests,other,0,0,0
adda43edc75b901b2329bca8f3eb74596698d05f,Calle Wilund,Wed May 18 11:48:47 2022 +0000,CDC - do not remove log table on CDC disable,other,0,0,0
0307cdd2bf91294c4eb8d208055040f34e1179c9,Raphael S. Carvalho,Tue May 24 20:22:32 2022 -0300,compaction: Fix incremental compaction logging,bug_fix,0,0,0
3dab0bfc8d44a7817d6f30632fddddf7d0205057,Pavel Emelyanov,Wed May 25 15:46:15 2022 +0300,tests: Remove sstables_manager& from column_family_test_config(),other,0,0,0
490bf65e1134cfab98538d8968259c405eed1dc7,Pavel Emelyanov,Wed May 25 15:30:19 2022 +0300,table: Move sstables_manager from config onto table itself,other,0,0,0
50e68105364affbde8850adc0ab60125eb4a2349,Pavel Emelyanov,Wed May 25 15:25:13 2022 +0300,"table, db, tests: Pass sstables_manager& into table constructor",other,0,0,0
7b3f9bb5fad635e577f40c40062565811d1f0be2,Konstantin Osipov,Thu May 26 14:09:58 2022 +0300,test: disable topology/test_null,other,0,0,0
dd633cdb21d439f86de46331e80d3689ffe2e1b8,Konstantin Osipov,Tue Apr 26 12:16:21 2022 +0300,test.py: respect --verbose even if output is a tty,logging_improvement,0,0,0
9512e076af59de9ec502b33243a360ee68b1f27d,Konstantin Osipov,Fri Apr 15 18:56:57 2022 +0300,test: remove tools/cql_repl,other,0,0,0
405517bc1b49e6f7659a48b2dc0dd1e6c95e34d5,Konstantin Osipov,Thu Mar 17 18:24:31 2022 +0300,test.py: implement CQL approval tests over pytest,feature,0,0,0
5b9262f56724a1de4bb4b25431d2f2532b14ddd6,Konstantin Osipov,Fri Jan 28 19:56:18 2022 +0300,test.py: add topology suite,feature,0,0,0
bc719209ee40148a1187317ca8ec44d2d64c3aad,Konstantin Osipov,Fri Jan 14 20:32:48 2022 +0300,test.py: introduce PythonTest and PythonTestSuite,other,0,0,0
7c1c83320c5604422e3886927ca9d9b6b763f448,Konstantin Osipov,Fri Dec 17 18:08:42 2021 +0300,test.py: (pylib) add Scylla Server and Artifact Registry,feature,0,0,0
1f8b529e08bc613ca250314b51bbd41f728c1d7a,Asias He,Thu Dec 16 13:04:49 2021 +0800,range_streamer: Disable restream logic,other,0,0,0
5b038affae7818786c4da838794149aec766d168,Benny Halevy,Thu May 19 13:48:53 2022 +0300,replica: distributed_loader: reindent handle_sstables_pending_delete,other,0,0,0
c5e5692a011055450e51d80f5fe58a56a82190d5,Eliran Sinvani,Wed May 18 14:47:58 2022 +0300,compaction_manager: Make invoking the empty constructor more explicit,other,0,0,0
9e1c76ea9e5ee752f48f1ebda97280aeb5634054,Benny Halevy,Thu May 12 18:15:56 2022 +0300,test: frozen_mutation_test: test_writing_and_reading_gently: log detailed error,other,0,0,0
883b97d8b2146d3775bc5b605118095f99aa23ca,Takuya ASADA,Wed Apr 27 12:18:13 2022 +0900,dist/common/scripts: generate debug log when exception occurred,bug_fix,0,0,0
528ab5a5026e83c35a6a3b6d476230b692099a2a,Avi Kivity,Thu May 12 22:13:31 2022 +0300,treewide: change metric calls from make_derive to make_counter,other,0,0,0
00ed4ac74c1ac86c0328ad5851fb5155e5b9b228,Michael Livshin,Thu May 12 10:28:57 2022 +0300,batchlog_manager: warn when a batch fails to replay,other,0,0,0
4a40e345779aeb1d35a98375c1b90f6106a12b70,Benny Halevy,Thu May 5 16:15:03 2022 +0300,docs: debugging.md: update instructions regarding backtrace.scylladb.com,bug_fix,0,0,0
01b1e54e22502c4fa9de1ffeddb386bcd29dbef8,Benny Halevy,Mon May 9 17:26:55 2022 +0300,api: storage_service: increase visibility of snapshot ops in the log,other,0,0,0
7e4bb68061eed2c0aa76f3734f44591752d309c2,Kamil Braun,Mon Mar 14 17:57:23 2022 +0100,service: raft: add/remove direct failure detector endpoints on group 0 configuration changes,feature,0,0,0
0f698910e80748f48efafdb6ac434b52b0bd9fc4,Pavel Emelyanov,Thu May 5 08:45:45 2022 +0300,cql_type_parser: Require user_types_storage& in parse(),other,0,0,0
2104d90dd04a3786d011219aa2b6128c2ad01ec9,Pavel Emelyanov,Thu May 5 09:32:44 2022 +0300,user_types: Carry storage on database and schema_ctxt,other,0,0,0
78350a7e1ba9a6cd11ab8e9075aeb885adc8178e,Calle Wilund,Mon May 2 14:29:01 2022 +0000,cdc: Ensure columns removed from log table are registered as dropped,other,0,0,0
29e09a3292b976b8ea28fdceb6d2e6c399f00232,Michał Radwański,Thu Apr 28 15:02:34 2022 +0200,db/config: command line arguments logger_stdout_timestamps and logger_ostream_type are no longer ignored,other,0,0,0
b25fc29801e9c40df6351406507a170e873d75ca,Pavel Emelyanov,Fri Apr 15 14:44:38 2022 +0300,test: Use cql-test-env gossiper,other,0,0,0
4bea0b749173731c073879325e7d86687cefbf78,Pavel Emelyanov,Fri Apr 15 14:38:05 2022 +0300,code: Use gossiper reference where possible,other,0,0,0
38c77d0d85794ea95016842fdfa3f53f6c262ae7,Pavel Emelyanov,Fri Apr 15 14:24:53 2022 +0300,snitch: Keep gossiper reference,other,0,0,0
e0c7178e7500f691e3ad1907d2d5582e54b85804,Eliran Sinvani,Sun May 1 08:04:42 2022 +0300,query_processor: remove default internal query caching behavior,other,0,0,0
b25e53a84550df062597a3793228c5bd339aab81,Raphael S. Carvalho,Thu Apr 28 20:10:33 2022 -0300,compaction: LCS: extract calculation of ideal level for input,other,0,0,0
272da51f80a7466c3004c5a3436d77ccba8de987,Botond Dénes,Wed Apr 27 16:27:05 2022 +0300,test/lib/mutation_source_test: remove upgrade_to_v2 tests,other,0,0,0
a9812166cde34d7798a4aa97f0427d023badac5b,Avi Kivity,Wed Apr 27 14:41:22 2022 +0300,"replica, partition_snapshot_reader, keys: replace boost::any with std::any",other,0,0,0
e88871f4ec49055b019a57a2f2b4be8b5276017f,Benny Halevy,Sun Apr 24 16:40:27 2022 +0300,replica: database: move shard_of implementation to mutation layer,feature,0,0,0
ca8f5dcdb7b3c2dfd4b6b9f4cded5426e0b1cad9,Raphael S. Carvalho,Tue Apr 26 10:39:49 2022 -0300,sstables: Rename dirname() to a more descriptive name,other,0,0,0
7f26a8eef52a3a79c0cdf566663b32945ccb319b,Gleb Natapov,Tue Apr 19 12:29:40 2022 +0300,raft: actively search for a leader if it is not known for a tick duration,other,0,0,0
db676e9e4a73c3872d7a5ed8ca59c3199a1b09e7,Benny Halevy,Sun Apr 24 14:00:57 2022 +0300,replica: database: apply: make sure the schema is synced or throw internal error,other,0,0,0
5da586271fa054224c691c59147bdb6eaaa4d8ef,Avi Kivity,Sun Apr 17 14:20:01 2022 +0300,repair: explicityl ignore tombstone gc update response,other,0,0,0
ee2c7948f3d55e6d331c4347ec4d3c395771a6b4,Benny Halevy,Sun Apr 10 17:49:40 2022 +0300,test: flat_mutation_reader_test: mock_consumer: add debug logging,bug_fix,0,0,0
aa7c6dfaa9f84b8821623b509d44c6f7b977c083,Avi Kivity,Tue Apr 12 11:28:36 2022 +0300,Merge 'Commitlog: refactor file handling - simplify file management + make bookkeep safer' from Calle Wilund,refactor,0,0,0
f05ae928490f980d90b332e2c02cd0b037d78277,Raphael S. Carvalho,Mon Apr 11 15:13:22 2022 -0300,compaction: move compaction::enable_garbage_collected_sstable_writer() into protected namespace,other,0,0,0
0fa703de3e2b47d975e4efc7df4bc76496e09aaf,Mikołaj Sielużycki,Mon Apr 11 18:45:30 2022 +0200,repair: Move row_repair hashing logic to separate class and file.,other,0,0,0
0e2a3e02ae8a78251a9a2342959d272d6847d39c,Calle Wilund,Mon Mar 14 15:09:13 2022 +0000,commitlog: Fold named_file continuations into caller coroutine frame,other,0,0,0
ed8f0df10580a47ae5bc5c6f3536d758015b58d0,Calle Wilund,Tue Feb 15 13:18:48 2022 +0000,commitlog: Use named named_file objects in delete/dispose/recycle lists,other,0,0,0
cdd4066006b10f495221981c03edbb84760dfe11,Calle Wilund,Tue Feb 15 10:12:00 2022 +0000,commitlog: Use named_file size tracking instead of segment var,other,0,0,0
320c49e8d320641e7483883652cfdb3512ae1f6b,Calle Wilund,Mon Feb 14 18:55:39 2022 +0000,commitlog: Use named_file in segment,other,0,0,0
97bf7b1fc8f2895951ce4e5b78c739f979e03294,Calle Wilund,Mon Feb 14 18:54:19 2022 +0000,"commitlog: Add ""named_file"" file wrapping type",feature,0,0,0
7dd7760e8db05d83fb63c2b7de58f2326e725157,Calle Wilund,Tue Aug 24 13:33:08 2021 +0000,commitlog: Make flush threshold a config parameter,other,0,0,0
d478896d4603b831ee4452d341dceb5b0e2cda24,Calle Wilund,Tue Aug 17 14:55:16 2021 +0000,commitlog: kill non-recycled segment management,other,0,0,0
828a95188638cb338425cd2ca80c9a12ff76445d,Pavel Emelyanov,Thu Apr 7 18:11:15 2022 +0300,snitch: Remove create_snitch/stop_snitch,other,0,0,0
633746b87d02a214fe86d8ee3507258119ed2496,Pavel Emelyanov,Thu Apr 7 16:14:22 2022 +0300,snitch: Make config-based construction of all drivers,other,0,0,0
4705a5fa42e4161ec2e47392d8432ce275314a9e,Piotr Sarna,Wed Mar 9 11:01:27 2022 +0100,test: improve output of schema_change_test regeneration,refactor,0,0,0
40ad057b6c69ab6c92880f9cde0a83a7921f7483,Benny Halevy,Thu Apr 7 12:46:32 2022 +0300,database: delete db_apply_executor forward declaration,other,0,0,0
f31c61c7c95ad2ac6e69ea75e3f6849cd99d772e,Kamil Braun,Tue Apr 5 19:19:57 2022 +0200,test: raft: randomized_nemesis_test: increase logging level on some rare operations,logging_improvement,0,0,0
af28fb6d941f559c3db169d2187bc7493ce85f27,Calle Wilund,Tue Apr 5 12:07:11 2022 +0000,perf_commitlog: Add bytes + bytes written stats,feature,0,0,0
12ab34a3d98870774ce3cd33af06c6a50588add8,Calle Wilund,Tue Apr 5 12:03:55 2022 +0000,test/perf/perf.hh: Make templated version of test routine to allow extended stats,other,0,0,0
5727f196e3efa449fc357939931d4a7ea5d78c7d,Lukasz Sojka,Wed Mar 16 14:58:25 2022 +0100,Add big batch logs tests,feature,0,0,0
e19cf6760ac0e3ae00719337f5415b1dd639fdd5,Botond Dénes,Fri Apr 1 09:49:46 2022 +0300,tools/scylla-sstable: add alternative schema load method for system tables,feature,0,0,0
aac51be0cc0a2e8f43a5fbe50e29d0e843c0f074,Michael Livshin,Thu Mar 31 18:35:44 2022 +0300,mutation_readers: refactor generic partition slicing logic,refactor,0,0,0
20a1ef3bee804b46da50765bdf876548fd83a410,Raphael S. Carvalho,Wed Mar 30 12:14:21 2022 -0300,compaction_backlog_tracker: Raise logging level to error when disabling tracker on exception,logging_improvement,0,0,0
3289df2e748af16fa57e3fe689f68a35bc48864b,Botond Dénes,Tue Mar 29 13:03:36 2022 +0300,readers: merge fmr_logger and mrlog,other,0,0,0
20c9e556e1ddf5a53a74fdb099ee3becf69d13fd,Botond Dénes,Tue Mar 29 12:29:00 2022 +0300,mutation_reader: move mrlog (mutation reader logger) to readers/,other,0,0,0
b7954138ac235eba5a275cd94d031bbd96b880d5,Botond Dénes,Fri Mar 25 15:09:00 2022 +0200,mutation_reader: move compacting reader into readers/,other,0,0,0
11c378a1751a6895a9c0537cf710f715aa7bf356,Botond Dénes,Fri Mar 25 15:07:54 2022 +0200,mutation_reader: move queue reader to readers/,other,0,0,0
11109f4c45e411cc9872f6e3082996fa69551e25,Botond Dénes,Fri Mar 25 15:02:16 2022 +0200,mutation_reader: move mutation source into readers/,other,0,0,0
f8015d9c26c0fd34c916457ea566a5cbb48cf841,Botond Dénes,Tue Mar 22 09:51:05 2022 +0200,readers: move combined reader into readers/,other,0,0,0
8d4dd53c25aa50e5f0bedf3f09055ad6847b8628,Kamil Braun,Sun Mar 13 22:23:23 2022 +0100,test: raft: logical_timer: add abortable version of `sleep_until`,feature,0,0,0
baedf1e4de8bf57e32da8a847df3881b90747add,Pavel Emelyanov,Fri Mar 25 18:25:21 2022 +0300,system_keyspace: Remove unused argument from maybe_write_in_user_memory,other,0,0,0
bdefea7c82bbd2674b8c133212921d0a5fbecab5,Takuya ASADA,Sun Mar 27 14:33:09 2022 +0900,docker: enable --log-to-stdout which mistakenly disabled,other,0,0,0
965d2a0a4f90203c44a4cf9dab2f12de1a0271e1,Pavel Emelyanov,Fri Mar 25 11:37:53 2022 +0300,"code,system_keyspace: Remove system_keyspace::get_local_host_id()",other,0,0,0
9a44c26d7e5963fdf931ca32106dbe84ebcdfb90,Botond Dénes,Fri Mar 18 08:41:40 2022 +0200,index/secondary_index_manager: switch to using data dictionary,other,0,0,0
4f2d900c9f8ab04ad94d1f4672181eeb0c297ffb,Botond Dénes,Fri Mar 18 09:39:19 2022 +0200,replica: disentangle data_dictionary_impl from database,other,0,0,0
56c383ba8ef8d6c8cfea4390ec97c6cdfe86917b,Calle Wilund,Tue Mar 15 14:43:13 2022 +0000,test/perf/perf_commitlog: Add a small commitlog throughput test,feature,0,0,0
9871c757e03dc97a3a1de88930398dca9b3c5738,Benny Halevy,Mon Mar 21 16:03:17 2022 +0200,HACKING: refer to backtrace.scylladb.com,logging_improvement,0,0,0
59c72d5d60fc2a51f2a068d1da723c6fccae0702,Takuya ASADA,Mon Feb 28 19:13:38 2022 +0900,scylla_prepare: print Traceback with current user-friendly messages,logging_improvement,0,0,0
011942dcce587b366df1a56171a2cc9493754226,Pavel Solodovnikov,Thu Mar 3 08:41:10 2022 +0300,raft: move tracking `SUPPORTS_RAFT_CLUSTER_MANAGEMENT` feature to raft,feature,0,0,0
58e520ab1df57804bd00bc75c4e213e0a03d896d,Raphael S. Carvalho,Tue Mar 15 14:45:04 2022 -0300,compaction: Move run_off_strategy_compaction() into compaction manager,other,0,0,0
ddf9dee9d8d085b708ab72ca681b734cb4ac001f,Botond Dénes,Wed Feb 23 13:04:00 2022 +0200,sstables/sstable: add validate_checksums(),feature,0,0,0
20fcf05586d0b36ba7e02f57e5e025d688187f76,Benny Halevy,Sun Mar 13 19:53:01 2022 +0200,replica/database: truncate: coroutinize per-view logic,other,0,0,0
8ed0909cc3872d7b389dbe01a1692eaa7881dc6c,Nadav Har'El,Mon Mar 14 17:11:24 2022 +0200,test/cql-pytest: add mechanism and example of testing Scylla log messages,feature,0,0,0
1d84a254c00b36dc2576e06ee288e28a13238195,Mikołaj Sielużycki,Thu Mar 10 12:07:32 2022 +0100,flat_mutation_reader: Split readers by file and remove unnecessary includes.,other,0,0,0
26b1be0b8fec4e32d29c8afc1d9891fb99536cca,Benny Halevy,Tue Sep 7 14:45:37 2021 +0300,test: lib: random_mutation_generator: accept optional random seed,other,0,0,0
67a7b7a3f40693b3b344d57b6e0f019014cb7536,Raphael S. Carvalho,Thu Mar 10 21:01:28 2022 -0300,compaction: rename interrupt() to a descriptive name,other,0,0,0
a2a5e530f022bba2209ef67f4acfdbc23f2d6ed5,Benny Halevy,Thu Mar 10 09:16:44 2022 +0200,compaction_manager: move per-type logic to derived task,other,0,0,0
20a86093921e5c8ca0a375b04f4c421f1837feb5,Benny Halevy,Sun Feb 27 12:35:47 2022 +0200,compaction_manager: task: standardize task description in log messages,other,0,0,0
11adb404c6bd5808be94f025d386627c5189ee76,Botond Dénes,Tue Feb 1 09:54:08 2022 +0200,sstables/metadata_collector: use position_in_partition for min/max keys,other,0,0,0
6544da342a88b97b57cd0d89871b4190efcb8185,Botond Dénes,Wed Feb 2 14:54:45 2022 +0200,test/lib/mutation_source_test: log name of each run_mutation_source(),other,0,0,0
a4756334cee208f5ccb080df222af78dde6e1eb6,Avi Kivity,Wed Mar 9 19:37:00 2022 +0200,"Merge ""tools/scylla-types: improve documentation"" from Botond",refactor,0,0,0
c7de2e06820edd376e692b2a67940203d7902f72,Benny Halevy,Mon Mar 7 11:12:54 2022 +0200,compaction: log info message when interrupting compaction,other,0,0,0
d1d3c620b295195bbf0c148662e530dac3f1d8e5,Benny Halevy,Wed Mar 2 10:15:45 2022 +0200,compaction_manager: embed task_stop into stop_tasks,other,0,0,0
bb1c4adb7c81c22224dabc3a75442d04454b8225,Pavel Emelyanov,Mon Feb 28 13:03:36 2022 +0300,storage_service: De-bloat waiting logs,other,0,0,0
2dba0670adfda55f1ad755cac459392fee22fc9b,Raphael S. Carvalho,Tue Mar 1 16:49:44 2022 -0300,compaction: Fix time_window_backlog_tracker::replace_sstables(),bug_fix,0,0,0
a389cc520b0cb052c5ecb4be5c8cca20f862a6ae,Michael Livshin,Tue Mar 1 14:39:26 2022 +0200,"system_keyspace, sstable: log local host id in key places",other,0,0,0
1584c5071080949eb36e62ef583563cdf869c9d2,Benny Halevy,Thu Feb 24 12:00:30 2022 +0200,compaction_manager: compacting_sstable_registration: keep a compaction_manager&,other,0,0,0
ebbbf1e68791b5664e632050908ddd1fdd17eb2b,Benny Halevy,Mon Feb 28 12:27:53 2022 +0200,lister: move to utils,other,0,0,0
05bd6b2bce4847b451f35859bd5425980ca37f73,Botond Dénes,Fri Feb 25 11:54:05 2022 +0200,tools/scylla-types: use fmt::print() instead of std::cout <<,other,0,0,0
d8833de3bb1274500e90590197df300a097d93ba,Botond Dénes,Fri Feb 25 09:21:08 2022 +0200,"Merge ""Redefine Compaction Backlog to tame compaction aggressiveness"" From Raphael S. Carvalho",other,0,0,0
ec59f7a0798f77cc14d2adac7ba658a30c53b346,Asias He,Tue Feb 22 15:14:58 2022 +0800,repair: Do not flush hints and batchlog if tombstone_gc_mode is not repair,other,0,0,0
2a7939ee4dab5c87d13475aef11b49f46db652e7,Raphael S. Carvalho,Wed Feb 2 15:28:20 2022 -0300,tests: Add compaction controller test,feature,0,0,0
a8caa679371f4cbe77711d25ffb932be3732d1dc,Raphael S. Carvalho,Thu Feb 24 15:57:31 2022 -0300,compaction/size_tiered_backlog_tracker.hh: Use unsigned type for inflight component,other,0,0,0
1d9f53c881c562b276250c4503801ee92d6d2aa6,Raphael S. Carvalho,Tue Feb 8 13:15:17 2022 -0300,compaction: Redefine compaction backlog to tame compaction aggressiveness,other,0,0,0
ddd693c6d7bb7222f17399fd87f934479f6b26ae,Raphael S. Carvalho,Mon Feb 21 16:51:40 2022 -0300,compaction_backlog_tracker: Batch changes through a new replacement interface,feature,0,0,0
84d843697ba6ce90ea69915baed3e9d6b8e6e90c,Raphael S. Carvalho,Mon Feb 21 16:35:45 2022 -0300,table: Disable backlog tracker when stopping table,other,0,0,0
26350c85916d94b1fd991479c68103a9bfb432bf,Raphael S. Carvalho,Mon Feb 21 16:37:40 2022 -0300,compaction_backlog_tracker: make disable() public,other,0,0,0
c15e055612188b2dc40aed09839519e3da443618,Raphael S. Carvalho,Mon Feb 21 16:26:10 2022 -0300,compaction_backlog_tracker: Clear tracker state when disabled,other,0,0,0
a70ce7ecb305e210c5aa3e55631411c6bb5dd7ea,Raphael S. Carvalho,Wed Feb 2 13:43:39 2022 -0300,compaction: Add normalized backlog metric,feature,0,0,0
680195564de7a54f5a6b2317a648a8e5671e1afe,Asias He,Wed Feb 23 13:54:04 2022 +0800,repair: Unify repair uuid report in the log,other,0,0,0
cbba80914de072b350b87676a77d146f9bb297e7,Avi Kivity,Tue Feb 22 16:03:36 2022 +0200,memtable: move to replica module and namespace,other,0,0,0
f5259e048ce47b148a4ad6e68a4b89d14902d3d8,Benny Halevy,Sun Feb 20 14:09:39 2022 +0200,test: sstable_compaction_test: stop compaction manager and test table using deferred action,other,0,0,0
d3ac9a579033ca4d534d3e233129377a50f9e1fe,Nadav Har'El,Sun Feb 20 12:09:57 2022 +0200,Merge 'cql3: expr: Fix expr::visit so that it works with references' from Jan Ciołek,bug_fix,0,0,0
971c431a23233a4df968f3e132b5aa264f7acaff,Pavel Emelyanov,Fri Oct 22 11:03:33 2021 +0300,code: Remove old on-disk version of system.clients table,other,0,0,0
8676f60724e699cee8151ef56e6f0dbd92b952f4,Jan Ciolek,Wed Feb 16 17:35:02 2022 +0100,cql3: expr: Fix expr::visit so that it works with references,bug_fix,0,0,0
f5c6d7e12e2f99ee83829d472c62adec801d3f96,Botond Dénes,Fri Jan 28 16:44:54 2022 +0200,tools/scylla-sstable: change output of dump-index to json,other,0,0,0
72f27c878271ee1a201d7f641858b0dfec8b7098,Botond Dénes,Fri Dec 3 14:15:32 2021 +0200,tools/scylla-sstable: use fmt::print in --dump-data,other,0,0,0
ba2a61b2bc798b4f2ce8234d543a1304fb77c91e,Botond Dénes,Thu Sep 16 11:56:31 2021 +0300,tools/scylla-sstable: prepare --dump-data for multiple output formats,other,0,0,0
0b1447c7025166112cf5e9e5338fd79c01b33a4b,Michael Livshin,Mon Jan 31 19:53:41 2022 +0200,"add ""sstable_format"" config",feature,0,0,0
7be3129458b4c414853e2df4cac69d3dbe8d7340,Nadav Har'El,Tue Feb 15 18:23:42 2022 +0200,cdc: don't need current keyspace to create the log table,other,0,0,0
5dbf86fa29fa921abd177e0ae3bd63539534ac82,Kamil Braun,Thu Feb 3 18:27:38 2022 +0100,db: system_keyspace: introduce discovery table,other,0,0,0
795d4a0bad1f1512f24bef306e348dd8fe868a7a,Benny Halevy,Mon Feb 14 11:06:07 2022 +0200,batchlog_manager: batchlog_replay_loop: ignore broken_semaphore if abort_requested,other,0,0,0
00a6fda7b98438184024fc4683b0accf1852e30c,Juliusz Stasiewicz,Fri Jan 28 17:56:55 2022 +0100,tracing: Trace slow queries on replicas wrt. parent's clock,logging_improvement,0,0,0
e892170c86314588aa83adf60d75939a0b5675ae,Pavel Solodovnikov,Thu Feb 10 10:34:18 2022 +0300,raft: add raft tables to `extra_durable_tables` list,feature,0,0,0
